CFIHOS-40000282,normal operating outlet temperature,Is a temperature that occurs during operation or under which an object is supposed to operate.,Number,,CFIHOS-45000028,TEMP,,,,,True
CFIHOS-40000283,normal operating rotational speed,The rotational speed which is the normal operating rotational speed for the functional or physical object.,Number,,CFIHOS-45000036,ANGVEL,,,,,True
CFIHOS-40000284,normal operating specific gravity,The specific gravity at which a functional or physical object is expected to operate normally.,Number,,CFIHOS-45000002,DENSI,,,,,True
CFIHOS-40000285,normal operating inlet steam pressure,The pressure at which a functional or physical object is expected to operate normally at its inlet steam.,Number,,CFIHOS-45000017,PRESS,,,,,True
CFIHOS-40000286,normal operating inlet steam temperature,The temperature at which a functional or physical object is expected to operate normally at its inlet steam.,Number,,CFIHOS-45000028,TEMP,,,,,True
CFIHOS-40000287,normal operating outlet steam pressure,The pressure at which a functional or physical object is expected to operate normally at its outlet steam.,Number,,CFIHOS-45000017,PRESS,,,,,True
CFIHOS-40000288,normal operating outlet steam temperature,The temperature at which a functional or physical object is expected to operate normally at its outlet steam.,Number,,CFIHOS-45000028,TEMP,,,,,True
CFIHOS-40000289,normal operating volume flow rate (at normal operating pressure and normal operating temperature),The volume flow rate at which a functional or physical object is expected to operate normally. The volume flow rate is calculated at normal operating pressure and normal operating temperature.,Number,,CFIHOS-45000034,VOLFLO,,,,,True
CFIHOS-40000292,normal output power,The power which is the power a functional or physical object deliver normally.,Number,,CFIHOS-45000016,POWER,,,,,True
CFIHOS-40000293,normal volume flow rate,A volume flow rate a functional or physical object is designed to deliver under normal conditions.,Number,,CFIHOS-45000034,VOLFLO,,,,,True
CFIHOS-40000294,nozzle external corrosion allowance,Is a thickness that is a bonus on a wall thickness to compensate for expected corrosion.,Number,,CFIHOS-45000011,LENGTH,,,,,True
CFIHOS-40000295,nozzle internal corrosion allowance,Is a thickness that is a bonus on a wall thickness to compensate for expected corrosion.,Number,,CFIHOS-45000011,LENGTH,,,,,True
CFIHOS-40000296,nozzle material,Is a possessed aspect being a role of the substance of an artefact when used to construct the artefact from. Therefore the substance should be in a solid state at the conditions at which the artefact exists.,Text,100,,,CFIHOS-50000070,material,,,True
CFIHOS-40000297,nozzle material specification,Is a specification which describes the applicable materials for one or more items.,Text,100,,,CFIHOS-50000073,material specification,,,True
CFIHOS-40000298,type of nozzle end,"A general description of how the nozzle is attached to the hose. For example bolted flange, welded etc",Text,40,,,CFIHOS-50000076,nozzle type,,,True
CFIHOS-40000299,number of capacity steps,Specify the number of steps in which the capacity can be regulated.,Number,,CFIHOS-45000037,COUNT,,,,,True
CFIHOS-40000300,number of circuits,The number of circuit-breakers in an electrical distribution board.,Number,,CFIHOS-45000037,COUNT,,,,,True
CFIHOS-40000301,number of cores,The number of cores of the functional or physical object.,Number,,CFIHOS-45000037,COUNT,,,,,True
CFIHOS-40000302,number of electrical phases,The number of phases in an electrical distribution system.,Number,,CFIHOS-45000037,COUNT,,,,,True
CFIHOS-40000303,number of electrical phases for circuit-breaker,The number of electrical phases a circuit-breaker is designed for.,Number,,CFIHOS-45000037,COUNT,,,,,True
CFIHOS-40000304,number of passes,Is a number of items where each item is a tube pass.,Number,,CFIHOS-45000037,COUNT,,,,,True
CFIHOS-40000305,number of passes per shell - shell side,Is a number of items where each item is a tube pass.,Number,,CFIHOS-45000037,COUNT,,,,,True
CFIHOS-40000306,number of passes per shell - tube side,Is a number of items where each item is a tube pass.,Number,,CFIHOS-45000037,COUNT,,,,,True
CFIHOS-40000307,number of shafts,Specifies the number of shafts for this functional or physical object.,Number,,CFIHOS-45000037,COUNT,,,,,True
CFIHOS-40000308,nutes material specification,Is a specification which describes the applicable materials for one or more items.,Text,100,,,CFIHOS-50000073,material specification,,,True
CFIHOS-40000309,operation continuous intermittent,Specifies if the equipment is working continuously or in an intermittent way.,Text,40,,,CFIHOS-50000077,operation continuous intermittent,,,True
CFIHOS-40000310,operation single/parallel,Specifies if the equipment is working alone or with similar equipment in parallel.,Text,40,,,CFIHOS-50000079,operation type,,,True
CFIHOS-40000311,orifice shape,"A general description of the physical shape of the orifice. For example conical entrance, quarter circle, square edge etc.",Text,40,,,CFIHOS-50000080,orifice shape,,,True
CFIHOS-40000312,outlet flange rating,Is a possessed aspect being a design pressure of a flange.,Text,40,,,CFIHOS-50000048,flange rating,,,True
CFIHOS-40000313,outlet flange size,Is a diameter by which a quantitative diameter is referred to. Typically a standardized value with defined tolerances.,Number,,CFIHOS-45000011,LENGTH,,,,,True
CFIHOS-40000314,paint code,The code of practice and the painting system within that practice with which the painting of a functional or physical object complies.,Text,40,,,,,,,True
CFIHOS-40000315,pipeline colour code,A colour identification of a pipeline according to the fluid conveyed.,Text,40,,,,,,,True
CFIHOS-40000316,pipeline material and grade,Specify the type and grade of material that the pipeline is constructed from.,Text,40,,,,,,,True
CFIHOS-40000317,position detection method,Provide a general description of the method used by the positioner to detect its location.,Text,40,,,CFIHOS-50000081,position detection method,,,True
CFIHOS-40000318,post weld heat treatment,Is a heat treatment after welding. Intended to ensure that the atomic structure of a weld and heat-affected zone is restored to an optimum corrosion-resistant structure.,Boolean,3,,,,,,,True
CFIHOS-40000319,power supply cooling method,"Specify the method of cooling the power supply. For example air, water etc.",Text,40,,,CFIHOS-50000082,power supply cooling method,,,True
CFIHOS-40000320,pressure equipment category,The pressure equipment category according to the pressure equipment directive 97/23/EC.,Text,40,,,CFIHOS-50000084,pressure equipment category,,,True
CFIHOS-40000321,process entrainments,Specify if and what entrainments the process media contains.,Text,40,,,CFIHOS-50000039,entrainment,,,True
CFIHOS-40000322,product stored,Specify the product which is stored in the functional or physical object.,Text,100,,,CFIHOS-50000051,fluid,,,True
CFIHOS-40000323,protection type,Specify whether the equipment has built-in protection measures from fishing equipment.,Text,40,,,CFIHOS-50000086,protection type,,,True
CFIHOS-40000324,rated impulse voltage,The voltage that the functional or physical object can withstand during abnormal conditions.,Number,,CFIHOS-45000038,VOLTAG,,,,,True
CFIHOS-40000325,rated output apparent power,Is an unusable theoretical power which occurs due to capacitive or inductive components. S=UI.,Number,,CFIHOS-45000016,POWER,,,,,True
CFIHOS-40000326,rated output frequency,The electrical frequency a functional or physical object is designed to deliver under specified conditions.,Number,,CFIHOS-45000009,FREQU,,,,,True
CFIHOS-40000327,rated output power for rectifier,The output power at which the rectifier of a functional or physical object has been designed to deliver under specified conditions.,Number,,CFIHOS-45000016,POWER,,,,,True
CFIHOS-40000328,rated output voltage,The voltage a functional or physical object is designed to deliver under specified conditions.,Number,,CFIHOS-45000038,VOLTAG,,,,,True
CFIHOS-40000329,rated power factor (lagging),Dimensionless number between 0 and 1. Cos F = P/S. Where P = upper limit power consumption and S = apparent Power.,Number,,CFIHOS-45000019,RATIO,,,,,True
CFIHOS-40000330,rated rotational speed,The rotational speed which is the rotational speed a functional or physical object has been designed to operate under specified condition.,Number,,CFIHOS-45000036,ANGVEL,,,,,True
CFIHOS-40000331,rated short circuit current,The current that the functional or physical object can carry under short circuit fault conditions.,Number,,CFIHOS-45000007,ECURR,,,,,True
CFIHOS-40000332,rated speed,The rotational speed a functional or physical object is designed to deliver under specified conditions.,Number,,CFIHOS-45000036,ANGVEL,,,,,True
CFIHOS-40000333,rated volume flow rate,A volume flow rate a functional or physical object is designed to deliver at specified conditions.,Number,,CFIHOS-45000034,VOLFLO,,,,,True
CFIHOS-40000334,relief bellows,Is a collection of items each of which is a relief bellow.,Boolean,3,,,,,,,True
CFIHOS-40000335,relief device type,Is a subtype of relief device,Text,40,,,CFIHOS-50000089,relief type,,,True
CFIHOS-40000336,relief valve set pressure,The pressure at which a functional or physical object is activated.,Number,,CFIHOS-45000017,PRESS,,,,,True
CFIHOS-40000337,remarks,Any further comments related to the functional or physical object.,Text,40,,,,,,,True
CFIHOS-40000338,roof plates corrosion allowance,Is a thickness that is a bonus on a wall thickness to compensate for expected corrosion.,Number,,CFIHOS-45000011,LENGTH,,,,,True
CFIHOS-40000339,roof plates material specification,Is a specification which describes the applicable materials for one or more items.,Text,100,,,CFIHOS-50000073,material specification,,,True
CFIHOS-40000340,sacrificial anodes,Whether or not an equipment is fitted with sacrificial corrosion prevention anodes.,Boolean,3,,,,,,,True
CFIHOS-40000341,sensing principle,"A general description of the technology used to carry out the detection function. For example infrared, ionisation, ultraviolet etc",Text,40,,,CFIHOS-50000092,sensing principle,,,True
CFIHOS-40000342,settle out pressure,The highest pressure which a functional or physical object will experience when not running and after equilibrium has been reached.,Number,,CFIHOS-45000017,PRESS,,,,,True
CFIHOS-40000343,shell coating,Is a material specification for a coating.,Text,40,,,CFIHOS-50000013,coating material,,,True
CFIHOS-40000344,shell corrosion allowance,Is a thickness that is a bonus on a wall thickness to compensate for expected corrosion.,Number,,CFIHOS-45000011,LENGTH,,,,,True
CFIHOS-40000345,shell dry weight,"Is a mass of an empty container, excluding the material it normally contains.",Number,,CFIHOS-45000013,MASS,,,,,True
CFIHOS-40000346,shell external corrosion allowance,Is a thickness that is a bonus on a wall thickness to compensate for expected corrosion.,Number,,CFIHOS-45000011,LENGTH,,,,,True
CFIHOS-40000347,shell hydrostatic test pressure - field,Is a test pressure applicable when using water to establish the test pressure.,Number,,CFIHOS-45000017,PRESS,,,,,True
CFIHOS-40000348,shell hydrostatic test pressure - shop,Is a test pressure applicable when using water to establish the test pressure.,Number,,CFIHOS-45000017,PRESS,,,,,True
CFIHOS-40000349,shell inside diameter,Is an inside diameter of an item that is the prime inside diameter in case the item has more than one inside diameter.,Number,,CFIHOS-45000011,LENGTH,,,,,True
CFIHOS-40000350,shell internal corrosion allowance,Is a thickness that is a bonus on a wall thickness to compensate for expected corrosion.,Number,,CFIHOS-45000011,LENGTH,,,,,True
CFIHOS-40000351,shell lining material,Is a material of construction of which a lining is made.,Text,100,,,CFIHOS-50000067,lining material,,,True
CFIHOS-40000352,shell lining material specification,Is a material specification for a lining.,Text,40,,,,,,,True
CFIHOS-40000353,shell material,Is a possessed aspect being a role of the substance of an artefact when used to construct the artefact from. Therefore the substance should be in a solid state at the conditions at which the artefact exists.,Text,100,,,CFIHOS-50000070,material,,,True
CFIHOS-40000354,shell material specification,Is a specification which describes the applicable materials for one or more items.,Text,100,,,CFIHOS-50000073,material specification,,,True
CFIHOS-40000355,shell minimum design metal temperature,"Is a temperature that is the lowest at which a significant load can be applied. Typically applied to a pressure vessel. Defined by the ASME Code, Section VIII, Division 1, paragraph UG-20 (see Section 3).",Number,,CFIHOS-45000028,TEMP,,,,,True
CFIHOS-40000356,shell normal external operating pressure,The pressure at which a functional or physical object is expected to operate normally.,Number,,CFIHOS-45000017,PRESS,,,,,True
CFIHOS-40000357,shell normal internal operating pressure,The pressure at which a functional or physical object is expected to operate normally.,Number,,CFIHOS-45000017,PRESS,,,,,True
CFIHOS-40000358,shell normal operating temperature,The temperature at which a functional or physical object is expected to operate normally.,Number,,CFIHOS-45000028,TEMP,,,,,True
CFIHOS-40000359,shell operating weight,Is a mass that includes possible internals when the item is completely filled with water.,Number,,CFIHOS-45000013,MASS,,,,,True
CFIHOS-40000360,shell outside diameter,Is an outside diameter of an item that is the prime outside diameter in case the item has more than one outside diameter.,Number,,CFIHOS-45000011,LENGTH,,,,,True
CFIHOS-40000361,shell plates corrosion allowance,Is a thickness that is a bonus on a wall thickness to compensate for expected corrosion.,Number,,CFIHOS-45000011,LENGTH,,,,,True
CFIHOS-40000362,shell side fluid name,The name of the product in liquid or gas phase.,Text,100,,,CFIHOS-50000051,fluid,,,True
CFIHOS-40000363,shell side upper limit design temperature,The highest temperature at which a functional or physical object is designed.,Number,,CFIHOS-45000028,TEMP,,,,,True
CFIHOS-40000364,shell side upper limit operating inlet temperature,Is a temperature that occurs during operation or under which an object is supposed to operate.,Number,,CFIHOS-45000028,TEMP,,,,,True
CFIHOS-40000365,shell side upper limit operating outlet temperature,Is a temperature that occurs during operation or under which an object is supposed to operate.,Number,,CFIHOS-45000028,TEMP,,,,,True
CFIHOS-40000366,shell test pressure,The pressure to which a functional or physical object should be subjected to test for leakage and structural integrity.,Number,,CFIHOS-45000017,PRESS,,,,,True
CFIHOS-40000367,shell upper limit design pressure,The highest pressure at which a functional or physical object is designed for.,Number,,CFIHOS-45000017,PRESS,,,,,True
CFIHOS-40000368,shell upper limit operating temperature,The temperature which is the highest temperature at which a functional or physical object is expected to operate.,Number,,CFIHOS-45000028,TEMP,,,,,True
CFIHOS-40000369,shell wall thickness,Is a thickness according to a design.,Number,,CFIHOS-45000011,LENGTH,,,,,True
CFIHOS-40000370,shell weld joint efficiency,Is a joint efficiency factor that is a correction factor for the strength of a weld dependent on the type and percentage examination. Its value is 1 in case of 100% radiographic examination.,Number,,CFIHOS-45000019,RATIO,,,,,True
CFIHOS-40000371,signal type,"Specify the type of technology used to transmit a signal. For example electric, pneumatic, smart electric etc",Text,40,,,CFIHOS-50000131,signal type,,,True
CFIHOS-40000372,special service,"Specifies if  the functional or physical object involves mediums (e.g. 'steam', 'hydrogen', 'hydrofluoric acid', 'chlorine', 'oxygen', 'ethylene-oxide', 'sour', 'sodium hydroxide', 'potassium hydroxide', 'amine') that attract additional requirements with respect to component.",Text,40,,,,,,,True
CFIHOS-40000373,specific heat ratio Cp/Cv at inlet,The specific heat ratio for the process medium at inlet conditions.,Number,,CFIHOS-45000019,RATIO,,,,,True
CFIHOS-40000374,spindle material specification,Is a specification which describes the applicable materials for one or more items.,Text,100,,,CFIHOS-50000073,material specification,,,True
CFIHOS-40000375,spring material specification,Is a specification which describes the applicable materials for one or more items.,Text,100,,,CFIHOS-50000073,material specification,,,True
CFIHOS-40000376,stack height,The maximum height of a functional or physical object above its base when installed.,Number,,CFIHOS-45000011,LENGTH,,,,,True
CFIHOS-40000377,stack inside diameter,Is an inside diameter of an item that is the prime inside diameter in case the item has more than one inside diameter.,Number,,CFIHOS-45000011,LENGTH,,,,,True
CFIHOS-40000378,stack length,Is a distance measured in the direction of the longest side of an item or in the direction of its main axis.,Number,,CFIHOS-45000011,LENGTH,,,,,True
CFIHOS-40000380,stack material,Is a possessed aspect being a role of the substance of an artefact when used to construct the artefact from. Therefore the substance should be in a solid state at the conditions at which the artefact exists.,Text,100,,,CFIHOS-50000070,material,,,True
CFIHOS-40000381,stack type,Is a subtype of stack,Text,40,,,CFIHOS-50000094,stack type,,,True
CFIHOS-40000382,stack wall thickness,Is a thickness according to a design.,Number,,CFIHOS-45000011,LENGTH,,,,,True
CFIHOS-40000383,stacking lining material,Is a material of construction of which a lining is made.,Text,100,,,CFIHOS-50000067,lining material,,,True
CFIHOS-40000384,steam drum inside diameter,Is an inside diameter of an item that is the prime inside diameter in case the item has more than one inside diameter.,Number,,CFIHOS-45000011,LENGTH,,,,,True
CFIHOS-40000385,steam drum length,Is a distance measured in the direction of the longest side of an item or in the direction of its main axis.,Number,,CFIHOS-45000011,LENGTH,,,,,True
CFIHOS-40000386,steam drum material specification,Is a specification which describes the applicable materials for one or more items.,Text,100,,,CFIHOS-50000073,material specification,,,True
CFIHOS-40000387,steam drum pressure relief device,By which protection is provided against overpressure.,Text,40,,,,,,,True
CFIHOS-40000388,steam drum relief valve set pressure,The pressure at which a functional or physical object is activated.,Number,,CFIHOS-45000017,PRESS,,,,,True
CFIHOS-40000389,steam drum shell wall thickness,Is a thickness according to a design.,Number,,CFIHOS-45000011,LENGTH,,,,,True
CFIHOS-40000390,steam section length,Is a distance measured in the direction of the longest side of an item or in the direction of its main axis.,Number,,CFIHOS-45000011,LENGTH,,,,,True
CFIHOS-40000391,steam section wall thickness,Is a thickness according to a design.,Number,,CFIHOS-45000011,LENGTH,,,,,True
CFIHOS-40000392,stream drum material,Is a possessed aspect being a role of the substance of an artefact when used to construct the artefact from. Therefore the substance should be in a solid state at the conditions at which the artefact exists.,Text,100,,,CFIHOS-50000070,material,,,True
CFIHOS-40000393,stress analysis required,Specifies if the functional or physical object requires a stress analysis.,Boolean,3,,,,,,,True
CFIHOS-40000394,subtransient reactance,"Quotient of the initial value of a sudden change in that fundamental A.C. component of primary voltage, which is produced by the total direct-axis primary flux, and the value of the simultaneous change in fundamental A.C. component of direct-axis primary",Number,,CFIHOS-45000019,RATIO,,,,,True
CFIHOS-40000395,superheater box length,Is a distance measured in the direction of the longest side of an item or in the direction of its main axis.,Number,,CFIHOS-45000011,LENGTH,,,,,True
CFIHOS-40000396,superheater box material specification,Is a specification which describes the applicable materials for one or more items.,Text,100,,,CFIHOS-50000073,material specification,,,True
CFIHOS-40000397,superheater box wall thickness,Is a thickness according to a design.,Number,,CFIHOS-45000011,LENGTH,,,,,True
CFIHOS-40000398,superheater corrosion allowance,Is a thickness that is a bonus on a wall thickness to compensate for expected corrosion.,Number,,CFIHOS-45000011,LENGTH,,,,,True
CFIHOS-40000399,superheater effective outside surface area,Is an area located on a surface.,Number,,CFIHOS-45000026,SURFAC,,,,,True
CFIHOS-40000400,superheater material,Is a possessed aspect being a role of the substance of an artefact when used to construct the artefact from. Therefore the substance should be in a solid state at the conditions at which the artefact exists.,Text,100,,,CFIHOS-50000070,material,,,True
CFIHOS-40000401,superheater number of tubes,Is a number of items where each item is a tube.,Number,,CFIHOS-45000037,COUNT,,,,,True
CFIHOS-40000402,superheater pressure relief device,By which protection is provided against overpressure.,Text,40,,,,,,,True
CFIHOS-40000403,superheater relief valve set pressure,The pressure at which a functional or physical object is activated.,Number,,CFIHOS-45000017,PRESS,,,,,True
CFIHOS-40000404,superheater tube outside diameter,Is an outside diameter of an item that is the prime outside diameter in case the item has more than one outside diameter.,Number,,CFIHOS-45000011,LENGTH,,,,,True
CFIHOS-40000405,support fire proofing type,Is a subtype of support for fire proofing,Text,40,,,CFIHOS-50000047,fire proof support type,,,True
CFIHOS-40000406,support type,Is a subtype of support,Text,40,,,CFIHOS-50000095,support type,,,True
CFIHOS-40000407,surface roughness,The average peak to valley distance for the small irregularities on a functional or physical objects internal surface.,Number,,CFIHOS-45000011,LENGTH,,,,,True
CFIHOS-40000408,tank roof drain type,Is a drainage system for a tank roof.,Text,40,,,CFIHOS-50000096,tank roof drain type,,,True
CFIHOS-40000409,tank roof type,Specify the type of roof construction for the functional or physical tank.,Text,40,,,CFIHOS-50000097,tank roof type,,,True
CFIHOS-40000410,tank usage type,Specify if the tank is designed to feed a determined set of equipments or designed to contain a large quantity of product for a long term storage.,Text,40,,,CFIHOS-50000098,tank usage type,,,True
CFIHOS-40000411,TEMA type,A classification system defined by the Tubular Exchangers Manufactured Association,Text,40,,,CFIHOS-50000099,TEMA type,,,True
CFIHOS-40000412,test medium,The medium used for testing purpose.,Text,40,,,CFIHOS-50000100,test medium,,,True
CFIHOS-40000413,thermal insulation coating thickness,The total thermal insulation coating system thickness.,Number,,CFIHOS-45000011,LENGTH,,,,,True
CFIHOS-40000414,thermal insulation coating type,The type of thermal insulation coating system.,Text,40,,,,,,,True
CFIHOS-40000415,tie rods material specification,Is a specification which describes the applicable materials for one or more items.,Text,100,,,CFIHOS-50000073,material specification,,,True
CFIHOS-40000416,top section inside diameter,Is an inside diameter of an item that is the prime inside diameter in case the item has more than one inside diameter.,Number,,CFIHOS-45000011,LENGTH,,,,,True
CFIHOS-40000417,top section length,Is a distance measured in the direction of the longest side of an item or in the direction of its main axis.,Number,,CFIHOS-45000011,LENGTH,,,,,True
CFIHOS-40000418,top section lower limit operating pressure,Is a pressure that is a minimum possible or allowed or occurring or required.,Number,,CFIHOS-45000017,PRESS,,,,,True
CFIHOS-40000419,top section lower limit operating temperature,The temperature which is the lowest temperature at  which a functional or physical object is expected to operate.,Number,,CFIHOS-45000028,TEMP,,,,,True
CFIHOS-40000420,top section normal operating pressure,The pressure at which a functional or physical object is expected to operate normally.,Number,,CFIHOS-45000017,PRESS,,,,,True
CFIHOS-40000421,top section normal operating temperature,The temperature at which a functional or physical object is expected to operate normally.,Number,,CFIHOS-45000028,TEMP,,,,,True
CFIHOS-40000422,top section upper limit operating temperature,The temperature which is the highest temperature at which a functional or physical object is expected to operate.,Number,,CFIHOS-45000028,TEMP,,,,,True
CFIHOS-40000423,total tank capacity,The volume of a tank from the bottom to the maximum safe filling height.,Number,,CFIHOS-45000033,VOLUME,,,,,True
CFIHOS-40000424,transformer cooling method,The method of cooling used by a transformer.,Text,40,,,CFIHOS-50000102,transformer cooling method,,,True
CFIHOS-40000425,tray type,Is a subtype of tray,Text,40,,,CFIHOS-50000103,tray type,,,True
CFIHOS-40000426,tube bundle design,"Provide a general description of the style of tubes used in the equipment. For example bayonet type, concentric type etc.",Text,40,,,CFIHOS-50000104,tube bundle design,,,True
CFIHOS-40000427,tube coating,Is a material specification for a coating.,Text,40,,,CFIHOS-50000013,coating material,,,True
CFIHOS-40000428,tube coating specification,Is a material of construction of which a coating is made.,Text,40,,,CFIHOS-50000013,coating material,,,True
CFIHOS-40000429,tube corrosion allowance,Is a thickness that is a bonus on a wall thickness to compensate for expected corrosion.,Number,,CFIHOS-45000011,LENGTH,,,,,True
CFIHOS-40000430,tube hydrostatic test pressure - field,Is a test pressure applicable when using water to establish the test pressure.,Number,,CFIHOS-45000017,PRESS,,,,,True
CFIHOS-40000431,tube hydrostatic test pressure - shop,Is a test pressure applicable when using water to establish the test pressure.,Number,,CFIHOS-45000017,PRESS,,,,,True
