CFIHOS-40001098,metering for downhole chemical injection - Line #1,Specify if metering for downhole chemical injection - Line #1 is required.,Boolean,3,,,,,IOGP JIP33 Alignment,,True
CFIHOS-40001099,metering for downhole chemical injection - Line #2,Specify if metering for downhole chemical injection - Line #2 is required.,Boolean,3,,,,,IOGP JIP33 Alignment,,True
CFIHOS-40001100,metering for downhole chemical injection - Line #3,Specify if metering for downhole chemical injection - Line #3 is required.,Boolean,3,,,,,IOGP JIP33 Alignment,,True
CFIHOS-40001101,metering for downhole chemical injection - Line #4,Specify if metering for downhole chemical injection - Line #4 is required.,Boolean,3,,,,,IOGP JIP33 Alignment,,True
CFIHOS-40001102,wellhead connector/mandrel type,The mandrel and wellhead connector type.,Text,40,,,CFIHOS-50000347,Wellhead connector/mandrel type,IOGP JIP33 Alignment,,True
CFIHOS-40001103,valve ROV override type,The valve ROV override type.,Text,40,,,CFIHOS-50000339,Valve ROV override type,IOGP JIP33 Alignment,,True
CFIHOS-40001104,location of additional 1 in tubing chemical injection line,The location for the single additional 1 in. (25 mm) OD tubing chemical injection line option.,Text,40,,,CFIHOS-50000271,Location of additional 1 in tubing chemical injection line,IOGP JIP33 Alignment,,True
CFIHOS-40001105,metering for chemical injection between PWV and PCV - Line #2,Specify if metering for chemical injection between PWV and PCV - Line #2 is required.,Boolean,3,,,,,IOGP JIP33 Alignment,,True
CFIHOS-40001106,VXT tree cap pressure-containing seals,The type of sealing (metal-to-metal or non-metallic) to be used for pressure-containing seals of the VXT tree cap.,Text,40,,,CFIHOS-50000344,VXT cap and tubing type of sealing,IOGP JIP33 Alignment,,True
CFIHOS-40001107,VXT tubing hanger external A annulus seals,The type of sealing (metal-to-metal or non-metallic) to be used for VXT tubing hanger external A annulus seals.,Text,40,,,CFIHOS-50000344,VXT cap and tubing type of sealing,IOGP JIP33 Alignment,,True
CFIHOS-40001108,downhole chemical injection line isolation valve material trim option,The material trim class for the downhole chemical injection line isolation valve.,Text,100,,,CFIHOS-50000204,annulus and isolation valve material trim,IOGP JIP33 Alignment,,True
CFIHOS-40001109,monogramming of underwater safety valves,Specify if the USVs are to be monogrammed per API.,Boolean,3,,,,,IOGP JIP33 Alignment,,True
CFIHOS-40001110,"minimum TRL for components, equipment, and assemblies","The minimum TRL for components, equipment and assemblies.",Text,40,,,CFIHOS-50000276,"Minimum TRL for components, equipment, and assemblies",IOGP JIP33 Alignment,,True
CFIHOS-40001111,chemical injection between annulus wing and master valve,The chemical injection line between annulus wing and master valve (AWV/AMV) isolation requirement type.,Text,40,,,CFIHOS-50000265,Line isolation requirement type,IOGP JIP33 Alignment,,True
CFIHOS-40001112,chemical injection between PMV and PWV - Line #1,Select the chemical injection line between PMV and PWV - Line #1 isolation requirement type.,Text,40,,,CFIHOS-50000265,Line isolation requirement type,IOGP JIP33 Alignment,,True
CFIHOS-40001113,tubing hanger rotational torque resistance capacity,The required rotational torque resistance capacity of the tubing hanger.,Text,40,,,CFIHOS-50000328,TH rotational torque resistance capacity,IOGP JIP33 Alignment,,True
CFIHOS-40001114,type of subsea tree,The type of subsea tree.,Text,40,,,CFIHOS-50000336,Type of tree,IOGP JIP33 Alignment,,True
CFIHOS-40001115,applicable to,Specify the procurement status of the data sheet.,Text,40,,,CFIHOS-50000388,applicable to,IOGP JIP33 Alignment,,True
CFIHOS-40001116,pump size,Specify the size of the pump.,Text,40,,,,,IOGP JIP33 Alignment,,True
CFIHOS-40001117,pump service type,Continuous or Intermittent service.,Text,40,,,CFIHOS-50000077,operation continuous intermittent,IOGP JIP33 Alignment,,True
CFIHOS-40001118,number of starts,The number of starts of the machine per unit of time.,Number,,CFIHOS-45000037,COUNT,,,IOGP JIP33 Alignment,,True
CFIHOS-40001119,instantaneous start up requirement,Specify whether instantaneous start-up is required.,Text,40,,,CFIHOS-50000308,required or not,IOGP JIP33 Alignment,,True
CFIHOS-40001120,pump operation type,Specify the pump operational mode.,Text,40,,,CFIHOS-50000304,pump operation mode,IOGP JIP33 Alignment,,True
CFIHOS-40001121,pump start-up mode,Specify the pump start-up mode.,Text,40,,,CFIHOS-50000354,pump start-up mode,IOGP JIP33 Alignment,,True
CFIHOS-40001122,individual pump flow control,Specify if the pump has an individual flow control.,Boolean,3,,,,,IOGP JIP33 Alignment,,True
CFIHOS-40001123,location heated or unheated,Specify if the location heated or unheated.,Text,40,,,CFIHOS-50000268,location heated or unheated,IOGP JIP33 Alignment,,True
CFIHOS-40001124,location sunlight protection,The equipment's protection to sunlight exposure.,Text,40,,,CFIHOS-50000272,location sunlight protection,IOGP JIP33 Alignment,,True
CFIHOS-40001125,location mounting,Specify the levelat which the equipment will be installed.,Text,40,,,CFIHOS-50000270,location mounting,IOGP JIP33 Alignment,,True
CFIHOS-40001126,special weather protection,Required weather protection like roof or winterization.,Text,40,,,CFIHOS-50000316,special weather protection,IOGP JIP33 Alignment,,True
CFIHOS-40001127,unusual service conditions,Specify if unusual service conditions not covered in purchase order documents apply.,Text,40,,,CFIHOS-50000337,unusual conditions,IOGP JIP33 Alignment,,True
CFIHOS-40001128,floating applications motion design criteria,Specify the metocean and floating facility data of the location where the equipment will be installed.,Text,250,,,,,IOGP JIP33 Alignment,,True
CFIHOS-40001129,hazardous area certification standard,The standard used to Specify hazardous areas.,Text,40,,,CFIHOS-50000249,hazardous area certification standard,IOGP JIP33 Alignment,,True
CFIHOS-40001130,ignition hazard assessment,Specify if ignition hazard assessment is required.,Text,40,,,CFIHOS-50000308,required or not,IOGP JIP33 Alignment,,True
CFIHOS-40001131,heating medium,Specify the heating medium.,Text,40,,,CFIHOS-50000355,heating medium,IOGP JIP33 Alignment,,True
CFIHOS-40001132,cooling water type,The type or quality of the required cooling water.,Text,40,,,,,IOGP JIP33 Alignment,,True
CFIHOS-40001133,fouling factor,The amount of fouling in the liquid.,Text,40,,,,,IOGP JIP33 Alignment,,True
CFIHOS-40001134,liquid type,Specify the liquid characteristics.,Text,40,,,CFIHOS-50000068,liquid hazardous category,IOGP JIP33 Alignment,,True
CFIHOS-40001135,corrosion due to,Description of the cause of the expected corrosion.,Text,40,,,,,IOGP JIP33 Alignment,,True
CFIHOS-40001136,erosion due to,Description of the cause of the expected erosion.,Text,40,,,,,IOGP JIP33 Alignment,,True
CFIHOS-40001137,NPSHA datum,"Specify the reference datum for the pump suction conditions, including NPSH3.",Text,40,,,CFIHOS-50000282,NPSHA datum,IOGP JIP33 Alignment,,True
CFIHOS-40001138,proposal for pump performance curve number,The graphically designed performance of a centrifugal pump (flowrate/head); proposed curve number.,Text,40,,,,,IOGP JIP33 Alignment,,True
CFIHOS-40001139,specific pump speed,The rotational speed which is the specific rotational speed for the pump.,Text,40,,,,,IOGP JIP33 Alignment,,True
CFIHOS-40001140,pump mounting method,The way the pump is mounted.,Text,70,,,CFIHOS-50000303,pump mounting method,IOGP JIP33 Alignment,,True
CFIHOS-40001141,pump casing type,The type and shape of the casing.,Text,40,,,CFIHOS-50000302,pump casing type,IOGP JIP33 Alignment,,True
CFIHOS-40001142,impeller type,Specify the pump impeller type.,Text,40,,,CFIHOS-50000359,impeller type,IOGP JIP33 Alignment,,True
CFIHOS-40001143,"component balance to ISO 21940-11, Grade G1.0","Specify whether the proposed pump rotating components are required to be dynamically balanced to ISO 21940-11, Grade G1.0.",Text,40,,,CFIHOS-50000308,required or not,IOGP JIP33 Alignment,,True
CFIHOS-40001144,inlet flange facing,Specify the inlet flange facing.,Text,40,,,CFIHOS-50000243,flange face type,IOGP JIP33 Alignment,,True
CFIHOS-40001145,suction nozzle position,Specify the suction nozzle flange position.,Text,40,,,CFIHOS-50000244,nozzle position,IOGP JIP33 Alignment,,True
CFIHOS-40001146,outlet flange facing,Specify the outlet flange facing.,Text,40,,,CFIHOS-50000243,flange face type,IOGP JIP33 Alignment,,True
CFIHOS-40001147,discharge nozzle position,Specify the discharge nozzle flange position.,Text,40,,,CFIHOS-50000244,nozzle position,IOGP JIP33 Alignment,,True
CFIHOS-40001148,nozzle load,The net forces and moments exerted on equipment nozzle.,Text,40,,,CFIHOS-50000356,nozzle load,IOGP JIP33 Alignment,,True
CFIHOS-40001149,auxiliary process-liquid piping construction,Specify the proposed pump auxiliary process-liquid piping construction required.,Text,40,,,CFIHOS-50000367,process-liquid piping construction,IOGP JIP33 Alignment,,True
CFIHOS-40001150,design approval prior to fabrication,Specify if design approval prior to fabrication is requiredfor the proposed equipment or part of equipment.,Text,40,,,CFIHOS-50000308,required or not,IOGP JIP33 Alignment,,True
CFIHOS-40001151,drain valve supplied by,Specify who is responsible for supplying the drain valve.,Text,40,,,CFIHOS-50000357,supplied by,IOGP JIP33 Alignment,,True
CFIHOS-40001152,vent valve supplied by,Specify who is responsible for supplying the vent valve.,Text,40,,,CFIHOS-50000357,supplied by,IOGP JIP33 Alignment,,True
CFIHOS-40001153,warm-up or cool-down line for instantaneous start up,Specify whether a separate warm-up or cooldown line is required for instantaneous start-up of the pump.,Text,40,,,CFIHOS-50000346,warm-up or cool-down line,IOGP JIP33 Alignment,,True
CFIHOS-40001154,machined and studded connections,Specify whether machined and studded connectionsare required for the proposed pump casing.,Text,40,,,CFIHOS-50000308,required or not,IOGP JIP33 Alignment,,True
CFIHOS-40001155,thread specification,Is a specification which describes the threads.,Text,40,,,CFIHOS-50000358,thread specification,IOGP JIP33 Alignment,,True
CFIHOS-40001156,bearing housing cooling method,Specify the pump bearing housing cooling methodrequired.,Text,40,,,CFIHOS-50000360,bearing housing cooling method,IOGP JIP33 Alignment,,True
CFIHOS-40001157,cooling water piping plan,Specify the pump cooling water plan required. Refer to Annex B for piping plans.,Text,40,,,CFIHOS-50000368,piping plan,IOGP JIP33 Alignment,,True
CFIHOS-40001158,purpose of insulation,Specify the purpose of insulation.,Text,40,,,CFIHOS-50000369,purpose of insulation,IOGP JIP33 Alignment,,True
CFIHOS-40001159,heat tracing and insulation location,Specify where heat tracing and insulation is to beapplied.,Text,100,,,,,IOGP JIP33 Alignment,,True
CFIHOS-40001160,heat tracing supplied by,Specify who is responsible for supplying heat tracing.,Text,40,,,CFIHOS-50000357,supplied by,IOGP JIP33 Alignment,,True
CFIHOS-40001161,insulation supplied by,Specify who is responsible for supplying insulation.,Text,40,,,CFIHOS-50000357,supplied by,,,True
CFIHOS-40001162,heating tracing specification,Is a specification which describes the heating tracing.,Text,40,,,CFIHOS-50000361,purchaser or vendor standard,IOGP JIP33 Alignment,,True
CFIHOS-40001163,insulation specification,Is a specification which describes the insulation.,Text,40,,,CFIHOS-50000361,purchaser or vendor standard,,,True
CFIHOS-40001164,shaft flexibility index reported by vendor,Specify if the shaft flexibility index (SFI) is to be reported by vendor.,Text,40,,,CFIHOS-50000308,required or not,IOGP JIP33 Alignment,,True
CFIHOS-40001165,shaft flexibility index,Specify the shaft flexibility index (SFI).,Text,40,,,,,IOGP JIP33 Alignment,,True
CFIHOS-40001166,OH3 back-pullout lifting device required,Specify if device for back-pullout and lifting of a OH3 type pump is required.,Text,40,,,CFIHOS-50000308,required or not,IOGP JIP33 Alignment,,True
CFIHOS-40001167,shrink fit limited movement impellers,Specify if shrink fit limited movement impellers are required.,Text,40,,,CFIHOS-50000308,required or not,IOGP JIP33 Alignment,,True
CFIHOS-40001168,pump thrust bearing location,Specify the location for the thrust bearing.,Text,40,,,CFIHOS-50000362,bearing location,IOGP JIP33 Alignment,,True
CFIHOS-40001169,strainer type,Specify the strainer type.,Text,100,,,,,IOGP JIP33 Alignment,,True
CFIHOS-40001170,type of level control,Specify the type of level control required.,Text,40,,,CFIHOS-50000363,type of level control,IOGP JIP33 Alignment,,True
CFIHOS-40001171,line shaft connection,Specify the type of line shaft connection required.,Text,40,,,CFIHOS-50000364,line shaft connection,IOGP JIP33 Alignment,,True
CFIHOS-40001172,line shaft configuration,Specify the line shaft configuration required.,Text,40,,,CFIHOS-50000365,line shaft configuration,IOGP JIP33 Alignment,,True
CFIHOS-40001173,line shaft bearing lube,Specify the type of line shaft bearing lubricationrequired.,Text,40,,,CFIHOS-50000366,line shaft bearing lube,IOGP JIP33 Alignment,,True
CFIHOS-40001174,hardened sleeves under line shaft bearings,Specify if hardened sleeves under line shaft bearings are required.,Text,40,,,CFIHOS-50000308,required or not,IOGP JIP33 Alignment,,True
CFIHOS-40001175,grade (underside of pump mounting plate or top of foundation) elevation,Specify the grade (underside of pump mounting plate or top of foundation) elevation at which the proposed pump is to be installed.,Text,40,,,,,IOGP JIP33 Alignment,,True
CFIHOS-40001176,radial bearing type,Specify the driver radial bearing type.,Text,40,,,CFIHOS-50000210,bearing type,IOGP JIP33 Alignment,,True
CFIHOS-40001177,thrust bearing type,Specify the thrustbearing type.,Text,40,,,CFIHOS-50000210,bearing type,IOGP JIP33 Alignment,,True
CFIHOS-40001178,review and acceptance of thrust bearing size,"Specify if the trust bearing size for the proposed pump is required to be reviewed and accepted. Applicable to API pump types BB1, BB2 and BB3.",Text,40,,,CFIHOS-50000308,required or not,IOGP JIP33 Alignment,,True
CFIHOS-40001179,rolling element bearing life calculations,Specify if the rolling element bearing life calculations are required for the bearing arrangement.,Text,40,,,CFIHOS-50000308,required or not,IOGP JIP33 Alignment,,True
CFIHOS-40001180,bearing lubrication method,Specify the lubrication method for the proposed pumpbearings.,Text,40,,,CFIHOS-50000370,bearing lubrication method,IOGP JIP33 Alignment,,True
CFIHOS-40001181,oil viscosity ISO grade,Specify the oil viscosity ISO grade.,Text,40,,,,,IOGP JIP33 Alignment,,True
CFIHOS-40001182,bearing lubrication specification,Is a specification which describes the bearing lubricant.,Text,40,,,,,IOGP JIP33 Alignment,,True
CFIHOS-40001183,grease type,Is a specification which describes the lubricant grease type.,Text,40,,,,,IOGP JIP33 Alignment,,True
CFIHOS-40001184,grease grade,Is a specification which describes the lubricant grease grade.,Text,40,,,,,IOGP JIP33 Alignment,,True
CFIHOS-40001185,oil mist reclassifiers supplied by,Specify who is responsible for supplying oil mist directionalreclassifiersforthe proposed pump.,Text,40,,,CFIHOS-50000357,supplied by,IOGP JIP33 Alignment,,True
CFIHOS-40001186,pump construction material,"Specify the material from which the pump is constructed according to API 610, Table H.1.",Text,100,,,CFIHOS-50000371,pump construction material,IOGP JIP33 Alignment,,True
CFIHOS-40001187,reduced-hardness materials,Specify if reduced-hardness materials arerequired.,Text,100,,,CFIHOS-50000308,required or not,IOGP JIP33 Alignment,,True
CFIHOS-40001188,material hardness standard,Specify the applicable material hardness standard.,Text,100,,,CFIHOS-50000372,material hardness standard,IOGP JIP33 Alignment,,True
CFIHOS-40001189,special coating requirement for impellers and other wetted parts,Specify if special coating for impellers and other wetted partsarerequired.,Text,40,,,CFIHOS-50000308,required or not,IOGP JIP33 Alignment,,True
CFIHOS-40001190,case and case cover material,The material from which the case and case cover is constructed.,Text,40,,,,,IOGP JIP33 Alignment,,True
CFIHOS-40001191,nonwetted pressure-retaining fasteners material,The material from which the nonwetted pressure-retaining fastener is constructed.,Text,40,,,,,IOGP JIP33 Alignment,,True
CFIHOS-40001192,diffuser material,The material from which the diffuser is constructed.,Text,40,,,,,IOGP JIP33 Alignment,,True
CFIHOS-40001193,impeller material,The material from which the impeller is constructed.,Text,40,,,,,IOGP JIP33 Alignment,,True
CFIHOS-40001194,inducer material,The material from which the inducer is constructed.,Text,40,,,,,IOGP JIP33 Alignment,,True
CFIHOS-40001195,impeller wear component type,Specify the impeller wear component type required for the proposed pump.,Text,40,,,CFIHOS-50000373,impeller wear component type,IOGP JIP33 Alignment,,True
CFIHOS-40001196,impeller wear component material,The material from which the impeller wear component is constructed.,Text,40,,,,,IOGP JIP33 Alignment,,True
CFIHOS-40001197,impeller wear component hardness,The hardness of the material from which the impeller wear component is constructed.,Text,40,,,,,IOGP JIP33 Alignment,,True
CFIHOS-40001198,case wear ring material,The material from which the case wear ring is constructed.,Text,40,,,,,IOGP JIP33 Alignment,,True
CFIHOS-40001199,wear parts hardnesses,The hardness of the material from which the wear parts is constructed.,Text,40,,,,,IOGP JIP33 Alignment,,True
CFIHOS-40001200,shaft material,The material from which the shaft is constructed.,Text,40,,,,,IOGP JIP33 Alignment,,True
CFIHOS-40001201,"auxiliary process-liquid lines, fittings and other connections to casing, including seal plans material","Specify the auxiliary process-liquid lines, fittings and other connections to casing, including seal plans materials of construction required.",Text,100,,,CFIHOS-50000387,auxiliary process-liquid lines,IOGP JIP33 Alignment,,True
CFIHOS-40001202,suction barrel/can material,The material from which the suction barrel/can is constructed.,Text,40,,,,,IOGP JIP33 Alignment,,True
CFIHOS-40001203,discharge head material,The material from which the discharge head is constructed.,Text,40,,,,,IOGP JIP33 Alignment,,True
CFIHOS-40001204,discharge column material,The material from which the discharge column is constructed.,Text,40,,,,,IOGP JIP33 Alignment,,True
CFIHOS-40001205,head column material,The material from which the head column is constructed.,Text,40,,,,,IOGP JIP33 Alignment,,True
CFIHOS-40001206,discharge elbow and pipe material,The material from which the discharge elbow and pipe is constructed.,Text,40,,,,,IOGP JIP33 Alignment,,True
CFIHOS-40001207,bowl/casing material,The material from which the bowl/casing is constructed.,Text,40,,,,,IOGP JIP33 Alignment,,True
CFIHOS-40001208,bellmouth/suction cover material,The material from which the bellmouth/suction cover is constructed.,Text,40,,,,,IOGP JIP33 Alignment,,True
CFIHOS-40001209,strainer material,The material from which the strainer is constructed.,Text,40,,,,,IOGP JIP33 Alignment,,True
CFIHOS-40001210,line shaft material,The material from which the line shaft is constructed.,Text,40,,,,,IOGP JIP33 Alignment,,True
CFIHOS-40001211,shaft enclosing tube material,The material from which the shaft enclosing tube is constructed.,Text,40,,,,,IOGP JIP33 Alignment,,True
CFIHOS-40001212,bowl shaft material,The material from which the bowl shaft is constructed.,Text,40,,,,,IOGP JIP33 Alignment,,True
CFIHOS-40001213,process wetted fasteners material,The material from which the process wetted fasteners is constructed.,Text,40,,,,,IOGP JIP33 Alignment,,True
CFIHOS-40001214,bearing retainer or spider material,The material from which the bearing retainer or spider is constructed.,Text,40,,,,,IOGP JIP33 Alignment,,True
CFIHOS-40001215,line shaft bearing material,The material from which the line shaft bearing is constructed.,Text,40,,,,,IOGP JIP33 Alignment,,True
CFIHOS-40001216,line shaft hard facing material,The material from which the line shaft hard facing is constructed.,Text,40,,,,,IOGP JIP33 Alignment,,True
CFIHOS-40001217,line shaft sleeves material,The material from which the line shaft sleeve is constructed.,Text,40,,,,,IOGP JIP33 Alignment,,True
CFIHOS-40001218,bearing lubrication lines material,The material from which the bearing lubrication lines is constructed.,Text,40,,,,,IOGP JIP33 Alignment,,True
CFIHOS-40001219,bowl bearing material,The material from which the bowl bearing is constructed.,Text,40,,,,,IOGP JIP33 Alignment,,True
CFIHOS-40001220,pump material inspection requirement,Specify the material inspection requirementsfor the proposed pump.,Text,100,,,CFIHOS-50000374,pump material inspection requirement,IOGP JIP33 Alignment,,True
CFIHOS-40001221,pump impact test,Specify the impact test standard required for the proposed pump.,Text,40,,,CFIHOS-50000375,pump impact test,IOGP JIP33 Alignment,,True
CFIHOS-40001222,"hardness testing of parts, welds and heat-affected zones","Specify is hardness testing of parts, welds and heat-affected zones is required.",Text,40,,,CFIHOS-50000308,required or not,IOGP JIP33 Alignment,,True
CFIHOS-40001223,additional surface/sub-surface examination,Specify if any additional surface/sub-surface examination is required.,Text,100,,,CFIHOS-50000308,required or not,IOGP JIP33 Alignment,,True
CFIHOS-40001224,additional surface/sub-surface examination components,Specify the components to be subjected toadditional surface/sub-surface examination.,Text,100,,,,,IOGP JIP33 Alignment,,True
CFIHOS-40001225,additional surface magnetic particle or liquid penetrant examination,Specify the type of surface examination required for components to be subjected toadditional surface/sub-surface examination.,Text,40,,,CFIHOS-50000376,NDT testing method,IOGP JIP33 Alignment,,True
CFIHOS-40001226,additional sub-surface ultrasonic or radiographic examination,Specify the type of sub-surface examination required for the components to be subjected toadditional surface/sub-surface examination.,Text,40,,,CFIHOS-50000376,NDT testing method,IOGP JIP33 Alignment,,True
CFIHOS-40001227,additional components positive material identification tested,Specify the additional components to be subjected to positive material identification (PMI) testing.,Text,40,,,,,IOGP JIP33 Alignment,,True
CFIHOS-40001228,repair and heat treatment records,Specify whether the vendor is required to keep repair and heat treatment records.,Text,40,,,CFIHOS-50000308,required or not,IOGP JIP33 Alignment,,True
CFIHOS-40001229,API baseplate number,Specify the API baseplate number for the proposed pump.,Text,40,,,CFIHOS-50000377,API pump baseplate number,IOGP JIP33 Alignment,,True
CFIHOS-40001230,pump baseplate sized to accommodate seal piping systems,Specify if theproposed pump baseplate is required to be sized to accommodate seal piping systems.,Text,40,,,CFIHOS-50000308,required or not,IOGP JIP33 Alignment,,True
CFIHOS-40001231,pump baseplate type,Specify the required baseplate type for the proposed pump.,Text,100,,,CFIHOS-50000378,pump baseplate type,IOGP JIP33 Alignment,,True
CFIHOS-40001232,pump baseplate mounting,Specify the requiredbaseplate mountingforthe proposed pump.,Text,40,,,CFIHOS-50000379,pump baseplate mounting,IOGP JIP33 Alignment,,True
CFIHOS-40001233,"stainless steel plate, thickness 0.2 in. (5 mm) minimum, under all pump feet","Specify if stainless steel plates, thickness 0.2 in. (5 mm)minimum, under all pump feet are required for theproposed pump.",Text,40,,,CFIHOS-50000308,required or not,IOGP JIP33 Alignment,,True
CFIHOS-40001234,API Standard 682 mechanical seal code,Specify the API Standard 682 mechanical seal code required for the proposed pump.,Text,40,,,,,IOGP JIP33 Alignment,,True
CFIHOS-40001235,API Standard 682 data sheet attached,Specify if anAPI Standard 682 mechanical seal data sheet is requiredfor the proposed pump.,Text,40,,,CFIHOS-50000308,required or not,IOGP JIP33 Alignment,,True
CFIHOS-40001236,pump mechanical seal primary plan,Specify the mechanical seal primary piping plan required for the proposed pump.,Text,40,,,CFIHOS-50000380,pump mechanical seal primary plan,IOGP JIP33 Alignment,,True
CFIHOS-40001237,pump mechanical seal primary plan construction,Specify the mechanical seal primary piping plan construction required for the proposed pump.,Text,40,,,CFIHOS-50000381,pump mechanical seal primary plan construction,IOGP JIP33 Alignment,,True
CFIHOS-40001238,pump mechanical seal secondary piping plan,Specify the mechanical seal secondarypiping plan required for the proposed pump.,Text,40,,,CFIHOS-50000385,pump mechanical seal secondary piping plan,IOGP JIP33 Alignment,,True
CFIHOS-40001239,additional central flush port,"Specify if an additional, centrally located, flush port on the top ofthe mechanical seal gland plate isrequired..",Text,40,,,CFIHOS-50000308,required or not,IOGP JIP33 Alignment,,True
CFIHOS-40001240,heating jacket required,Specify if a heating jacket isrequired..,Text,40,,,CFIHOS-50000308,required or not,IOGP JIP33 Alignment,,True
CFIHOS-40001241,coupling specification,Is a specification which describes the coupling.,Text,40,,,,,IOGP JIP33 Alignment,,True
CFIHOS-40001242,coupling size,A general description of the size of the coupling to the drive shaft of an equipment item.,Text,40,,,,,,,True
CFIHOS-40001243,coupling rating (power/100 rpm),Specify the coupling rating power/100 rpm for the proposed pump.,Text,40,,,,,IOGP JIP33 Alignment,,True
CFIHOS-40001244,coupling components balance grade,Specify the required coupling component balance grade for the proposed pump.,Text,40,,,CFIHOS-50000382,coupling components balance grade,IOGP JIP33 Alignment,,True
