CFIHOS-68000182,CFIHOS-30000806,ball control valve,CFIHOS-90000055,IOGP S-562:2019,S-562#22,Inspection documents,dimensional report,"Inspection documents on all pressure-containing (body, bonnet, closures, covers, bolting) and pressure-controlling parts (obturator, seats, stems, trunnions).",,equipment,technical information deliverables,"S-562, Table J4, 23",,,CFIHOS-70000439,dimensional report,no,yes,yes,,,,,,WPTD,AFD,no,
CFIHOS-68000182,CFIHOS-30000807,ball valve,CFIHOS-90000055,IOGP S-562:2019,S-562#22,Inspection documents,dimensional report,"Inspection documents on all pressure-containing (body, bonnet, closures, covers, bolting) and pressure-controlling parts (obturator, seats, stems, trunnions).",,equipment,technical information deliverables,"S-562, Table J4, 23",,,CFIHOS-70000439,dimensional report,no,yes,yes,,,,,,WPTD,AFD,no,
CFIHOS-68000183,CFIHOS-30000806,ball control valve,CFIHOS-90000055,IOGP S-562:2019,S-562#23,Pressure test report,factory acceptance and pressure test report and certificates,"Pressure test report (including pressure, test duration, test medium, and acceptance criteria) including copy of chart recorder used on pressure test",,equipment,technical information deliverables,"S-562, Table J4, 24",,,CFIHOS-70000287,pressure test report,no,yes,yes,,,,,,WAT,AFD,no,
CFIHOS-68000183,CFIHOS-30000807,ball valve,CFIHOS-90000055,IOGP S-562:2019,S-562#23,Pressure test report,factory acceptance and pressure test report and certificates,"Pressure test report (including pressure, test duration, test medium, and acceptance criteria) including copy of chart recorder used on pressure test",,equipment,technical information deliverables,"S-562, Table J4, 24",,,CFIHOS-70000287,pressure test report,no,yes,yes,,,,,,WAT,AFD,no,
CFIHOS-68000184,CFIHOS-30000806,ball control valve,CFIHOS-90000055,IOGP S-562:2019,S-562#24,Fugitive emission test report,fugitive emission test report,The manufacturer will provide a fugitive emission test report in accordance with Annex V,,equipment,technical information deliverables,"S-562, Annex V",,,CFIHOS-70000108,emissions report,no,yes,yes,,,,,,WAT,AFD,no,
CFIHOS-68000184,CFIHOS-30000807,ball valve,CFIHOS-90000055,IOGP S-562:2019,S-562#24,Fugitive emission test report,fugitive emission test report,The manufacturer will provide a fugitive emission test report in accordance with Annex V,,equipment,technical information deliverables,"S-562, Annex V",,,CFIHOS-70000108,emissions report,no,yes,yes,,,,,,WAT,AFD,no,
CFIHOS-68000185,CFIHOS-30000806,ball control valve,CFIHOS-90000055,IOGP S-562:2019,S-562#25,Certificate of conformance,certificate of conformance,The manufacturer will provide a Certificate of Conformance to the API specification and also the relevant IOGP supplementary Standard.,,equipment,technical information deliverables,"S-562, Table J4, 27",,,CFIHOS-70000013,approval certificate,no,yes,yes,,,,,,WPTD,AFD,no,
CFIHOS-68000185,CFIHOS-30000807,ball valve,CFIHOS-90000055,IOGP S-562:2019,S-562#25,Certificate of conformance,certificate of conformance,The manufacturer will provide a Certificate of Conformance to the API specification and also the relevant IOGP supplementary Standard.,,equipment,technical information deliverables,"S-562, Table J4, 27",,,CFIHOS-70000013,approval certificate,no,yes,yes,,,,,,WPTD,AFD,no,
CFIHOS-68000186,CFIHOS-30000806,ball control valve,CFIHOS-90000055,IOGP S-562:2019,S-562#26,Certificate of conformance (Sour service),certificate of conformance,The manufacturer will provide a certificate of conformance to ANSI/NACE MR0175/ISO 15156 or ISO17945/MR0103.,,equipment,technical information deliverables,"S-562, Table J4, 28",,,CFIHOS-70000013,approval certificate,no,yes,yes,,,,,,,AFD,no,
CFIHOS-68000186,CFIHOS-30000807,ball valve,CFIHOS-90000055,IOGP S-562:2019,S-562#26,Certificate of conformance (Sour service),certificate of conformance,The manufacturer will provide a certificate of conformance to ANSI/NACE MR0175/ISO 15156 or ISO17945/MR0103.,,equipment,technical information deliverables,"S-562, Table J4, 28",,,CFIHOS-70000013,approval certificate,no,yes,yes,,,,,,,AFD,no,
CFIHOS-68000187,CFIHOS-30000806,ball control valve,CFIHOS-90000055,IOGP S-562:2019,S-562#27,Manufacturers valve data report,manufacturing records,The manufacturer will provide all required manufacturing records tabulated per item.,,equipment,technical information deliverables,"S-562, 13.1",,,CFIHOS-70000416,manufacturer datasheet,no,yes,yes,,,,,,WAD,AFD,no,
CFIHOS-68000187,CFIHOS-30000807,ball valve,CFIHOS-90000055,IOGP S-562:2019,S-562#27,Manufacturers valve data report,manufacturing records,The manufacturer will provide all required manufacturing records tabulated per item.,,equipment,technical information deliverables,"S-562, 13.1",,,CFIHOS-70000416,manufacturer datasheet,no,yes,yes,,,,,,WAD,AFD,no,
CFIHOS-68000188,CFIHOS-30000806,ball control valve,CFIHOS-90000055,IOGP S-562:2019,S-562#28,Studded connection gasket certification,certificate of conformance,Certification for studded connection gaskets,,equipment,technical information deliverables,"S-562, 5.9.1, 6.9",,,CFIHOS-70000013,approval certificate,no,yes,yes,,,,,,WAD,AFD,no,
CFIHOS-68000188,CFIHOS-30000807,ball valve,CFIHOS-90000055,IOGP S-562:2019,S-562#28,Studded connection gasket certification,certificate of conformance,Certification for studded connection gaskets,,equipment,technical information deliverables,"S-562, 5.9.1, 6.9",,,CFIHOS-70000013,approval certificate,no,yes,yes,,,,,,WAD,AFD,no,
CFIHOS-68000189,CFIHOS-30000806,ball control valve,CFIHOS-90000055,IOGP S-562:2019,S-562#29,Recommended spare parts list,spare parts list,"Identified products which may require replacement are listed in a spare parts list identified and described so that the necessary spare, the whole item or parts can be obtained.The spare parts list includes:- reference to project documentation (e.g. dra",,equipment,technical information deliverables,,,,CFIHOS-70000374,spare part list,no,yes,yes,,,,,,WAO,AFD,no,
CFIHOS-68000189,CFIHOS-30000807,ball valve,CFIHOS-90000055,IOGP S-562:2019,S-562#29,Recommended spare parts list,spare parts list,"Identified products which may require replacement are listed in a spare parts list identified and described so that the necessary spare, the whole item or parts can be obtained.The spare parts list includes:- reference to project documentation (e.g. dra",,equipment,technical information deliverables,,,,CFIHOS-70000374,spare part list,no,yes,yes,,,,,,WAO,AFD,no,
CFIHOS-68000190,CFIHOS-30000370,switchgear and controlgear,CFIHOS-90000066,IOGP S-620:2018,IEC62271-1#01,General Arrangement details,general arrangement diagram,The manufacturer's standard general arrangement drawing showing overall dimensions and critical interface dimensions. The drawing contains references to main specifications and standards.  For equipment / components the drawing may include cross sectional,,equipment,technical information deliverables,IEC62271-200 Clause 9.2,,,CFIHOS-70000153,general arrangement diagram,,no,no,,,,,,,AFD,yes,
CFIHOS-68000191,CFIHOS-30000370,switchgear and controlgear,CFIHOS-90000066,IOGP S-620:2018,IEC62271-1#02,Foundation and Installation details,installation drawing,"The manufacturer's standard installation drawing showing; Critical interface dimensions Interface connections Weight of assemblies, equipment and components Centre of gravity Withdrawal/installation and maintenance space. Installation and moun",,equipment,technical information deliverables,IEC62271-200 Clause 9.2,,,CFIHOS-70000119,installation diagram,no,yes,yes,,,,,,WAO,AFC,yes,
CFIHOS-68000192,CFIHOS-30000370,switchgear and controlgear,CFIHOS-90000066,IOGP S-620:2018,IEC62271-1#03,"Installation, Operation and Maintenance (IOM) Manual","installation , operation and maintenance (iom) manual","The manufacturer's standard IOM manual.This document includes sufficient information to install, operate and maintain the equipment.This document includes sufficient information for troubleshooting.If required a supplementary sheet can be added identif",,equipment,technical information deliverables,IEC62271-1 Clause 11.4,,,CFIHOS-70000228,operating manual,no,yes,yes,,,,,,WPTD,AFD,yes,
CFIHOS-68000193,CFIHOS-30000370,switchgear and controlgear,CFIHOS-90000066,IOGP S-620:2018,IEC62271-1#04,Recommended Spare Part List (RSPL),spare part list (rspl),"Identified products which may require replacement are listed in a spare parts list identified and described so that the necessary spare, the whole item or parts can be obtained.The spare parts list includes:- reference to project documentation (e.g. dra",,equipment,technical information deliverables,"S-620 Clause 5.0.104, IEC 62271-1 Clause 11.4",,,CFIHOS-70000374,spare part list,no,yes,yes,,,,,,WPTD,AFC,yes,
CFIHOS-68000194,CFIHOS-30000370,switchgear and controlgear,CFIHOS-90000066,IOGP S-620:2018,IEC62271-1#05,Lifting Equipment Test Certificate,test certificate,Lifting equipment test certificate in relation switchgear load certified hoist,,equipment,technical information deliverables,S620 Clause 10.1.2,,,CFIHOS-70000432,lifting certificate,no,yes,yes,,,,,,WPTD,AFD,yes,
CFIHOS-68000195,CFIHOS-30000370,switchgear and controlgear,CFIHOS-90000066,IOGP S-620:2018,IEC62271-1#06,Weight Data Sheet,weight report,Document with weight of individual shipping sections,,equipment,technical information deliverables,IEC62271-200 Clause 9.2,,,CFIHOS-70000359,weight report,no,yes,yes,,,,,,WAO,AFC,yes,
CFIHOS-68000196,CFIHOS-30000370,switchgear and controlgear,CFIHOS-90000066,IOGP S-620:2018,IEC62271-1#07,Routine Verification Test (FAT) Results,test report,This document records and documents all results from the activities performed in accordance with the FAT procedure. Include any observation rework retesting.,,equipment,technical information deliverables,IEC 62271-1 Clause 8,,,CFIHOS-70000245,inspection report,,yes,yes,,,,,,WAT,AFC,yes,
CFIHOS-68000197,CFIHOS-30000370,switchgear and controlgear,CFIHOS-90000066,IOGP S-620:2018,IEC62271-200#02,Heat Dissipation Calculation & Loads,calculation,This document contains the calculation by the manufacturer to arrive at the heat load produced by the switchgear to enable HVAC sizing and includes load factors and type of load provided to the manufacturer to produce accurate calculation,,equipment,technical information deliverables,S-620 Clause 9.2,,,CFIHOS-70000441,heat dissipation calculation,no,yes,yes,,,,,,WAO,AFC,yes,
CFIHOS-68000198,CFIHOS-30000370,switchgear and controlgear,CFIHOS-90000066,IOGP S-620:2018,IEC62271-200#03,Chemical Inventory and Material Safety Data Sheets,material safety data sheets,"A structured form containing information on the safety, health and environmental protection aspects of the chemical, including protective measures andemergency actions.Safety Data Sheets (SDS) to be in accordance with local/national regulations and in t",,equipment,technical information deliverables,IEC62271-1Clause 13,,,CFIHOS-70000211,safety datasheet,no,yes,yes,,,,,,WPTD,AFD,yes,
CFIHOS-68000199,CFIHOS-30000370,switchgear and controlgear,CFIHOS-90000066,IOGP S-620:2018,MD#01,Supplier Master Information Schedule,information deliverables list,Schedule of specific information deliverables developed by the manufacturer and accepted by the user to meet the information requirements defined in the agreed Information Requirements Specification (IRS).The schedule typically defines; a) information d,,equipment,contract management information deliverables,Contract Requirement,,,CFIHOS-70000099,master document register,no,yes,yes,,,,,,WAO,AFC,yes,native
CFIHOS-68000200,CFIHOS-30000370,switchgear and controlgear,CFIHOS-90000066,IOGP S-620:2018,MD#02,Delivery schedule,delivery/production schedule,"Schedule depicting, as applicable to the service or product scope, design, supply, manufacture, inspection, testing and delivery activities to be executed by manufacturer/suppliers.Schedule details typically**  include;.a) Contractual milestonesb) Act",Preliminary with proposal,equipment,contract management information deliverables,Contract Requirement,,,CFIHOS-70000298,procurement schedule,yes,yes,yes,,,,,,WAO,AFD,yes,native
CFIHOS-68000201,CFIHOS-30000370,switchgear and controlgear,CFIHOS-90000066,IOGP S-620:2018,MD#03,Progress Report,progress report,"Report detailing activities completed in the period, percent complete against planned, activities planned for the next period, risks/areas of concern, cause of any delays and proposed recovery plans, concessions, internal and outsourced inspection and aud",,equipment,contract management information deliverables,Contract Requirement,,,CFIHOS-70000300,progress report,no,yes,yes,,,,,,WAO,AFD,yes,PDF
CFIHOS-68000202,CFIHOS-30000370,switchgear and controlgear,CFIHOS-90000066,IOGP S-620:2018,MD#04,Quality Plan,quality plan,"Plan specifying the actions, responsibilities and associated resources to be applied by the manufacturer, and when applicable sub-suppliers, to deliver the services or procured item(s) in conformance with the agreed requirements. ISO9001 Clause 8.1 and",Preliminary with proposal,equipment,contract management information deliverables,Contract Requirement,,,CFIHOS-70000451,quality plan,yes,no,yes,,WAO,,WAO,,,AFD,yes,native
CFIHOS-68000203,CFIHOS-30000370,switchgear and controlgear,CFIHOS-90000066,IOGP S-620:2018,MD#05,Design and Development Plan,design and development plan,NOT RELEVANT FOR HVSG,,equipment,contract management information deliverables,Contract Requirement,,,CFIHOS-70000404,project plan,,no,no,,,,,,,AFD,yes,
CFIHOS-68000204,CFIHOS-30000370,switchgear and controlgear,CFIHOS-90000066,IOGP S-620:2018,MD#06,Sub-Supplier Delivery Schedule,sub-supplier list,"Definition of processes, products or services that will be externally provided and the controls to be applied by the [supplier] to ensure conformance with agreed requirements. The schedule includes evidence of the basis of capability assessment , quality",Preliminary with proposal,equipment,contract management information deliverables,Contract Requirement,,,CFIHOS-70000455,sub-supplier list,yes,yes,yes,,,,,,WAO,AFD,yes,PDF
CFIHOS-68000205,CFIHOS-30000370,switchgear and controlgear,CFIHOS-90000066,IOGP S-620:2018,MD#07,Inspection and Test Plan (ITP),inspection and test plan (itp),"Tabular presentation of a quality plan typically used  for process or product applications to define the specific sequence of operational activities, instructions, acceptance criteria, records and associated manufacturer, user and independent conformity a",Preliminary with proposal,equipment,contract management information deliverables,Contract Requirement,,,CFIHOS-70000180,inspection and test plan,yes,no,yes,,WAO,,WAO,,,AFD,yes,native
CFIHOS-68000206,CFIHOS-30000370,switchgear and controlgear,CFIHOS-90000066,IOGP S-620:2018,MD#08,"Handling, shipping and storage procedure","handling, shipping and storage procedure","Definition of practices to be followed during the; storage, transport, lifting and preservation of the equipment and materials included in the scope of supply to maintain their  functionality and guarantees.Procedures typically define:a) Packaging requi",,equipment,contract management information deliverables,Contract Requirement,,,CFIHOS-70000154,"handling, shipping, storage procedure",no,yes,yes,,,,,,WPTD,AFD,yes,PDF
CFIHOS-68000207,CFIHOS-30000370,switchgear and controlgear,CFIHOS-90000066,IOGP S-620:2018,MD#09,Non-conformance records,non-conformance history,Details of  non-conformances raised by or to the manufacturer/sub suppliers against  technical requirements prior to or during the delivery of the products or services. Non-conformance is managed by the manufacturer in accordance with ISO9001 Clause 8.7 a,,equipment,contract management information deliverables,Contract Requirement,,,CFIHOS-70000226,non conformance report,no,yes,yes,,,,,,WPTD,AFC,yes,PDF
CFIHOS-68000208,CFIHOS-30000370,switchgear and controlgear,CFIHOS-90000066,IOGP S-620:2018,MD#10,Concession requests,concession request,"Formal submission seeking user agreement to accept deviations from the contracted scope or technical requirements. Requests may be raised as a result of, as examples, material or service availability, obsolescence, innovation, non-conformance.Requests ar",,equipment,contract management information deliverables,Contract Requirement,,,CFIHOS-70000389,technical deviation request,no,no,yes,,WAO,,WAO,,,AFC,yes,native
CFIHOS-68000209,CFIHOS-30000370,switchgear and controlgear,CFIHOS-90000066,IOGP S-620:2018,MD#11,Obsolescence management plan,management plan,"Plan defining the manufacturer's co-ordinated activities to direct and control the strategies for the identification and mitigation of the effects of obsolescence to the user, through all stages of the life of all components within the high-voltage switch",Preliminary with proposal,equipment,contract management information deliverables,S-620 Clause 5.0.103,,,CFIHOS-70000447,obsolescence management plan,yes,yes,yes,,,,,,WAO,AFD,yes,PDF
CFIHOS-68000210,CFIHOS-30000370,switchgear and controlgear,CFIHOS-90000066,IOGP S-620:2018,S-620#02,CT sizing calculations,calculation,"Calculations to size the CT's, e.g. burden and accuracy class.",,equipment,technical information deliverables,S-620 Clause 9.2,,,CFIHOS-70000086,design calculation,no,yes,yes,,,,,,WAO,AFC,yes,
CFIHOS-68000211,CFIHOS-30000370,switchgear and controlgear,CFIHOS-90000066,IOGP S-620:2018,S-620#03,Current transformer characteristics,characteristics,The magnetization and transient characteristics of the current transformers.,,equipment,technical information deliverables,S-620 Clause 9.2,,,CFIHOS-70000416,manufacturer datasheet,no,yes,yes,,,,,,WAO,AFC,yes,
CFIHOS-68000212,CFIHOS-30000370,switchgear and controlgear,CFIHOS-90000066,IOGP S-620:2018,S-620#04,High-voltage protective devices characteristics and ratings,characteristics,"Time-current characteristics of high-voltage protection devices provided with the switchgear and controlgear assembly, e.g. motor-starter fuse and protection relay curves.",,equipment,technical information deliverables,S-620 Clause 9.2,,,CFIHOS-70000416,manufacturer datasheet,no,yes,yes,,,,,,WAO,AFC,yes,
CFIHOS-68000213,CFIHOS-30000370,switchgear and controlgear,CFIHOS-90000066,IOGP S-620:2018,S-620#05,Utility load calculation,calculation,Summarises the normal and transient DC and AC utility loads of the switchgear for the purpose of sizing external power provision.,,equipment,technical information deliverables,IEC 62271-1Clause 10.3,,,CFIHOS-70000259,general report,no,yes,yes,,,,,,WAO,AFC,yes,
CFIHOS-68000214,CFIHOS-30000370,switchgear and controlgear,CFIHOS-90000066,IOGP S-620:2018,S-620#06,Connection Diagram,connection diagram,"Drawing providing information about the external physical connections per functional unit including hydraulic, pneumatic and electrical connections.",,equipment,technical information deliverables,IEC 62271-1Clause 11.3.5,,,CFIHOS-70000055,connection diagram,no,yes,yes,,,,,,WAO,AFC,yes,
CFIHOS-68000215,CFIHOS-30000370,switchgear and controlgear,CFIHOS-90000066,IOGP S-620:2018,S-620#07,Switchgear I/O schedule,schedule,Schedule of tags identifying IED programmable addresses and hardwired signal interfaces for all functional units within the switchgear and control gear assembly.,,equipment,technical information deliverables,S-620Clause 5.4.1.1,,,CFIHOS-70000179,"input, output list",no,yes,yes,,,,,,WAO,AFC,yes,
CFIHOS-68000216,CFIHOS-30000370,switchgear and controlgear,CFIHOS-90000066,IOGP S-620:2018,S-620#08,Functional logic diagram,logic diagram,Control logic embedded in IEDs (e.g. protection relays) that is developed by the manufacturer to implement the requirements of the user diagrams and associated protection relay settings.,,equipment,technical information deliverables,S-620Clause 5.115.3,,,CFIHOS-70000248,logic diagram,no,no,yes,,WAO,,WAO,,,AFC,yes,
CFIHOS-68000217,CFIHOS-30000370,switchgear and controlgear,CFIHOS-90000066,IOGP S-620:2018,S-620#09,Switchgear single line diagram,single line diagram,"Drawing detailing major items of equipment, including protection devices per functional unit using IEC 60617 standard symbols and/or ANSI C37.2 device function numbers per switchgear and controlgear assembly.",,equipment,technical information deliverables,S-620 Clause 9.2,,,CFIHOS-70000371,single line diagram,no,no,yes,,WAO,,WAO,,,AFC,yes,
CFIHOS-68000218,CFIHOS-30000370,switchgear and controlgear,CFIHOS-90000066,IOGP S-620:2018,S-620#10,Circuit and wiring diagram,circuit and wiring diagram,"Drawing detailing in schematic form the functional unit in respect of electrical and instrument circuit connections based on the principles in IEC 61082-1, Preparation of documents used in electrotechnology - Part 1: Rules.  The circuit(s) to be shown to",,equipment,technical information deliverables,S-620 Clause 9.2,,,CFIHOS-70000268,wiring diagram,no,no,yes,,WAO,,WAO,,,AFC,yes,
CFIHOS-68000219,CFIHOS-30000370,switchgear and controlgear,CFIHOS-90000066,IOGP S-620:2018,S-620#11,Inter-panel diagram,connection diagram,Wiring diagram detailing the control and auxiliary interfaces between functional units within the switchgear and controlgear assembly.  The wiring diagram identifies functional unit inter-connection and field run connections to be made during assembly of,,equipment,technical information deliverables,S-620 Clause 9.2,,,CFIHOS-70000055,connection diagram,no,yes,yes,,,,,,WAO,AFC,yes,
CFIHOS-68000220,CFIHOS-30000370,switchgear and controlgear,CFIHOS-90000066,IOGP S-620:2018,S-620#12,Probability of failure on demand reliability data,reliability data,Identifies reliability input data for functional unit and protection relay probability of failure on demand (PFD) to enable user to perform functional safety requirements assessments to IEC 61511.,,equipment,technical information deliverables,S-620 Clause 5.115.2,,,CFIHOS-70000312,"reliability, availability, safety integrity level calculation",no,yes,yes,,,,,,WAO,AFC,yes,
CFIHOS-68000221,CFIHOS-30000370,switchgear and controlgear,CFIHOS-90000066,IOGP S-620:2018,S-620#13,IED Interrogation and Programming Software,software,Software required to access and program the relays and programmable devices in the HV switchgear,,equipment,technical information deliverables,S-620 Clause 5.115.3,,,CFIHOS-70000012,application software,no,yes,yes,,,,,,WAO,AFC,yes,
CFIHOS-68000222,CFIHOS-30000370,switchgear and controlgear,CFIHOS-90000066,IOGP S-620:2018,S-620#14,Relay IED configuration files,software configuration file,Relay and programmable configuration devices files (native files and PDF),,equipment,technical information deliverables,S-620 Clause 5.113.3,,,CFIHOS-70000012,application software,no,yes,yes,,,,,,WPTT,AFC,yes,
CFIHOS-68000223,CFIHOS-30000370,switchgear and controlgear,CFIHOS-90000066,IOGP S-620:2018,S-620#15,IEC 61850 configuration files,software configuration file,Substation Configuration Description (SCD) or Configured IED Description (CID) files,,equipment,technical information deliverables,S-620 Clause 5.115.4,,,CFIHOS-70000012,application software,no,yes,yes,,,,,,WPTT,AFC,yes,
CFIHOS-68000224,CFIHOS-30000370,switchgear and controlgear,CFIHOS-90000066,IOGP S-620:2018,S-620#16,Bill of materials,bill of materials,"A list of parts, components and sub-assemblies for equipment with part numbers, item numbers, quantities, material designations and references to specifications including sub-suppliers and associated purchase orders.",,equipment,technical information deliverables,IEC62271-200Clause 9.2,,,CFIHOS-70000028,bill of materials,no,yes,yes,,,,,,WPTD,AFC,yes,
CFIHOS-68000225,CFIHOS-30000370,switchgear and controlgear,CFIHOS-90000066,IOGP S-620:2018,S-620#17,Type test report,test certificate,"A document that provides a summary of type tests, including the specific year and edition of the IEC used to perform the type test for all discrete functional units provided",,equipment,technical information deliverables,IEC 62271-200Clause 6.1,,,CFIHOS-70000239,general certificate,no,yes,yes,,,,,,WPTD,AFD,yes,
CFIHOS-68000226,CFIHOS-30000370,switchgear and controlgear,CFIHOS-90000066,IOGP S-620:2018,S-620#18,ECMS simulation test procedure,test procedure,User-agreed functional test procedure of the ECMS or its parts using the parameter set for the planned application including communication interfaces with integrated control and safety systems.,,equipment,technical information deliverables,"S-620 Clause 7.107,S-620Q Annex A",,,CFIHOS-70000332,test procedure,,no,yes,,WPTT,,WPTT,,,AFD,yes,
CFIHOS-68000227,CFIHOS-30000370,switchgear and controlgear,CFIHOS-90000066,IOGP S-620:2018,S-620#19,ECMS simulation test report,test report,Results from the execution of ECMS simulation test procedure including communication interfaces with integrated control and safety systems.,,equipment,technical information deliverables,S-620 Clause 7.107S-620Q Annex A,,,CFIHOS-70000245,inspection report,,yes,yes,,,,,,WAT,AFC,yes,
CFIHOS-68000228,CFIHOS-30000370,switchgear and controlgear,CFIHOS-90000066,IOGP S-620:2018,S-620#20,Routine Verification Test (FAT) Procedure,test procedure,"Procedure documenting the manufacturers recommended testing activities and acceptance criteria according to applicable standards, specifications and requirements, to document the condition of the equipment as tested from factory. Procedure to define test",,equipment,technical information deliverables,"IEC 62271-200 Clause 7,S-620Q Annex A",,,CFIHOS-70000332,test procedure,no,yes,yes,,,,,,WPTT,AFD,yes,
