CFIHOS-68001798,CFIHOS-30000370,switchgear and controlgear,CFIHOS-90000240,IOGP S-560:2022,S560-IR-203,Manufacturer data sheet,Manufacturer data sheet,"To include confirmation of compliance with S-560D by providing actual values of switchgear specification and all other information in accordance with IEC 61439-1:2020, Annex C, and IEC 61439-2:2021,Annex AA.",,equipment,technical information deliverables,6.2.2,,,CFIHOS-70000416,manufacturer datasheet,Yes,Yes,No,,,,,,,,,PDF
CFIHOS-68001799,CFIHOS-30000370,switchgear and controlgear,CFIHOS-90000240,IOGP S-560:2022,S560-IR-204,Special tools list,Special tools list,"The special tools list identifies special tool and equipment necessary for handling, installation, dismantling, operation and maintenance of the switchgear, including circuit breaker operating handles, earthing switch operating handles and software interr",,equipment,technical information deliverables,6.2.2,,,CFIHOS-70000454,special tools list,No,No,Yes,,,,,,,,,PDF
CFIHOS-68001800,CFIHOS-30000370,switchgear and controlgear,CFIHOS-90000240,IOGP S-560:2022,S560-IR-206,Cyber security certification,Cyber security documentation,Certification confirming compliance with IEC 62243-4-2 for industrial automation and control system components.,,equipment,technical information deliverables,6.2.2,,,CFIHOS-70000318,risk assessment,No,No,Yes,,,,,,,,,
CFIHOS-68001801,CFIHOS-30000370,switchgear and controlgear,CFIHOS-90000240,IOGP S-560:2022,S560-IR-207,Commissioning Instruction,Commissioning instruction,Instruction providing information on the commissioning of the product. Instructions for commissioning are provided especially for large and highly complex products and for large industrial installations. The purpose of such instructions is to provide the ,,equipment,technical information deliverables,6.2.2,,,CFIHOS-70000366,work instruction,No,No,Yes,,,,,,,,,PDF
CFIHOS-68001802,CFIHOS-30000370,switchgear and controlgear,CFIHOS-90000240,IOGP S-560:2022,S560-IR-209,Arc fault protection installation details,Installation manual,"Minimum room clearance dimensions, overpressure calculations and other installation guidelines (e.g. the arrangement of the pressure relief flaps, arc ducts, exhaust vents, if any) and the method of fixing the assembly as in service to the floor and the w",,equipment,technical information deliverables,9.3.1,,,CFIHOS-70000181,installation manual,No,Yes,No,,,,,,,,,PDF
CFIHOS-68001803,CFIHOS-30000370,switchgear and controlgear,CFIHOS-90000240,IOGP S-560:2022,S560-IR-210,Sub-component routine test report,Test report,"Test reports detailing the results of routine tests in accordance with the relevant IEC for individual sub-components such as voltage transformers, current transformers and air circuit breakers.",,equipment,technical information deliverables,6.2.2,,,CFIHOS-70000245,inspection report,No,No,Yes,,,,,,,,,PDF
CFIHOS-68001804,CFIHOS-30000521,centrifugal pump,CFIHOS-90000308,IOGP S-615:2023,S615-IR-148,Reference list,General list,"Supplier shall provide detailed references of at least two units of the equipment model offered (at the proposed point of manufacture) having comparable power and power per stage, speed, operating and design pressures, operating and design temperatures, p",,equipment,technical information deliverables,"6.1.1.1, 6.1.1.2, 9.2.4.1.1, Table 18",,,CFIHOS-70000247,general list,Yes,Yes,No,,,,,,,,,PDF
CFIHOS-68001805,CFIHOS-30000521,centrifugal pump,CFIHOS-90000308,IOGP S-615:2023,S615-IR-149,Hazardous area certificate (type),Hazardous area certificate (type),"Attestation issued by a recognised independent authority certifying that a type test has satisfied the specified standards; e.g. ATEX, BASEEFA, PTB, UL, CSA, NEMA, EX, etc. Examples of ratings include Intrinsically Safe & Explosion Proof. To include any s",,equipment,technical information deliverables,6.1.29.2,,,CFIHOS-70000160,hazardous area certificate,No,No,Yes,,,,,,,,,PDF
CFIHOS-68001806,CFIHOS-30000521,centrifugal pump,CFIHOS-90000308,IOGP S-615:2023,S615-IR-150,Installation instructions,Installation manual,"As per the requirements of L.3.5.1 and L.3.5.2 of API Standard 610. Note: Unless otherwise agreed, the Installation instructions can be delivered as a single manual or combined with the Operation and Maintenance manuals as long as each is clearly identifi","Installation Manual index, if required, should be provided in first revision of the document. When index agreed, Installation manual content shall be provided in subsequent revision of the document. Manual shall include sections covering all equipment sup",equipment,technical information deliverables,"8.2.1.1, 8.4.7, L.1.2, L.3.5.1, L.3.5.1.1, L.3.5.2.1, L.3.5.2.2, L.3.5.2.3, L.3.5.2.4, L.3.5.2.5, L.3.6.1, L.3.6.2",,,CFIHOS-70000181,installation manual,No,No,Yes,,,,,,,,,PDF
CFIHOS-68001807,CFIHOS-30000521,centrifugal pump,CFIHOS-90000308,IOGP S-615:2023,S615-IR-151,Operation instructions,Operating manual,"Provides sufficient information to operate the equipment, as well as sufficient information for troubleshooting. Description of methods of operating a piece of equipment, process unit or special tool, including but not limited to instructions, procedures,","Operating Manual index, if required, should be provided in first revision of the document. When index agreed, Operating manual content shall be provided in subsequent revision of the document. Manual shall include sections covering all equipment supplied ",equipment,technical information deliverables,"8.2.1.1, 6.1.28, 6.11.2, 6.4.3.7, 7.1.3, L.1.2, L.3.5.1, L.3.5.1.1, L.3.5.3, L.3.6.1, L.3.6.2",,,CFIHOS-70000228,operating manual,No,No,Yes,,,,,,,,,PDF
CFIHOS-68001808,CFIHOS-30000521,centrifugal pump,CFIHOS-90000308,IOGP S-615:2023,S615-IR-152,Maintenance instructions,Maintenance manual,"Provides sufficient information to install, operate and maintain the equipment, as well as sufficient information for troubleshooting. Description of methods of maintaining a specific piece of equipment. Typically originates from the equipment or package ","Maintenance Manual index, if required, should be provided in first revision of the document. When index agreed, Maintenance manual content shall be provided in subsequent revision of the document. Manual shall include sections covering all equipment suppl",equipment,technical information deliverables,"6.1.31, 6.7.3, 8.2.1.1, 6.1.28, 6.11.2, 7.1.3, L.3.5.1, L.3.5.1.1, L.3.5.3, L.3.6.1, L.3.6.2",,,CFIHOS-70000206,maintenance manual,No,No,Yes,,,,,,,,,PDF
CFIHOS-68001809,CFIHOS-30000521,centrifugal pump,CFIHOS-90000308,IOGP S-615:2023,S615-IR-153,Baseplate flatness testing procedure,Mechanical test procedure,Written description of the procedure for check of baseplate flatness according to API Standard 610 section 7.4.8.,,equipment,technical information deliverables,"7.4.8, 9.3.8.3.1",,,CFIHOS-70000332,test procedure,No,No,Yes,,,,,,,,,PDF
CFIHOS-68001810,CFIHOS-30000521,centrifugal pump,CFIHOS-90000308,IOGP S-615:2023,S615-IR-154,Weld maps,Welding traceability records,Weld maps to clearly show the location and type of the proposed weld.,Submit at proposal stage if specified in the data sheet,equipment,technical information deliverables,"6.12.2.5, 6.12.3.1, 6.12.3.4.2, 6.6.15.1, 9.2.1.4, Table 11",,,CFIHOS-70000245,inspection report,No,No,No,,,,,,,,,PDF
CFIHOS-68001811,CFIHOS-30000521,centrifugal pump,CFIHOS-90000308,IOGP S-615:2023,S615-IR-158,Ignition hazard assessment,Hazard identification report,A report which details the quantitative or qualitative ignition hazard risk related to coupling guards materials of construction. Note: methodology and reporting to conform with the principles and guidance provided in EN ISO 80079-36.,,equipment,technical information deliverables,"7.3.2.2, 7.3.3.4",,,CFIHOS-70000156,hazard identification report,No,Yes,No,,,,,,,,,PDF
CFIHOS-68001812,CFIHOS-30000521,centrifugal pump,CFIHOS-90000308,IOGP S-615:2023,S615-IR-159,Positive material identification (PMI) procedure,Positive material identification (PMI) procedure,Procedure describing the method for material identification by elemental analysis. Methods typically conform to ASTM E 415-14: carbon and low alloy steels; ASTM E 1086-14: austenitic stainless steels.,,equipment,technical information deliverables,"8.2.2.8, 6.4.3.10",,,CFIHOS-70000227,non destructive test procedure,No,No,Yes,,,,,,,,,PDF
CFIHOS-68001813,CFIHOS-30000521,centrifugal pump,CFIHOS-90000308,IOGP S-615:2023,S615-IR-161,Hardness test procedure,Test procedure,"The hardness of parent materials, welds and their heat-affected zones play important roles in determining the Sulphide Stress Cracking (SSC) resistance of the material. Hardness control is used during manufacturing, fabrication and field inspection as an ",,equipment,technical information deliverables,"8.2.2.7, 6.4.3.10",,,CFIHOS-70000332,test procedure,No,No,Yes,,,,,,,,,PDF
CFIHOS-68001814,CFIHOS-30000521,centrifugal pump,CFIHOS-90000308,IOGP S-615:2023,S615-IR-162,Hardness test records,Test report,"The hardness of parent materials, welds and their heat-affected zones play important roles in determining the Sulphide Stress Cracking (SSC) resistance of the material. Hardness control is used during manufacturing, fabrication and field inspection as an ",,equipment,technical information deliverables,"8.2.2.7, 6.4.3.10",,,CFIHOS-70000245,inspection report,No,No,Yes,,,,,,,,,PDF
CFIHOS-68001815,CFIHOS-30000521,centrifugal pump,CFIHOS-90000308,IOGP S-615:2023,S615-IR-163,Nameplate photograph,Name plate drawing,Photograph of completed nameplate attached to the equipment.,,equipment,technical information deliverables,6.13.2,,,CFIHOS-70000445,name plate diagram,No,No,No,,,,,,,,,PDF
CFIHOS-68001816,CFIHOS-30000521,centrifugal pump,CFIHOS-90000308,IOGP S-615:2023,S615-IR-164,Materials test report (2.2),Materials test report (2.2),"A document in which the supplier declares that the products supplied are in compliance with the requirements of the PO, and in which test results are supplied based on non-specific inspection and testing .",,equipment,technical information deliverables,"L.3.6.1, Table H.3",,,CFIHOS-70000412,material certificate,No,Yes,No,,,,,,,,,PDF
CFIHOS-68001817,CFIHOS-30000521,centrifugal pump,CFIHOS-90000308,IOGP S-615:2023,S615-IR-20,Supplier master information schedule,Information deliverables list,Schedule of specific information deliverables developed by the vendor and accepted by the purchaser to meet the information requirements defined in the agreed Information Requirements Specification (IRS). The schedule typically defines; a) information del,,equipment,contract management information deliverables,10.1,,,CFIHOS-70000099,master document register,No,Yes,No,,,,,,,,,Native
CFIHOS-68001818,CFIHOS-30000521,centrifugal pump,CFIHOS-90000308,IOGP S-615:2023,S615-IR-21,Delivery schedule,Delivery/production schedule,"Schedule depicting, as applicable to the service or product scope, design, supply, manufacture, inspection, testing and delivery activities to be executed by vendor/sub-vendors. Schedule details typically** include; a) Contractual milestones, b) Activity ",,equipment,contract management information deliverables,IOGP S-615:2023,,,CFIHOS-70000298,procurement schedule,Yes,No,Yes,,,,,,,,,PDF
CFIHOS-68001819,CFIHOS-30000521,centrifugal pump,CFIHOS-90000308,IOGP S-615:2023,S615-IR-22,Progress report,Progress report,"Report detailing activities completed in the period, percent complete against planned, activities planned for the next period, risks/areas of concern, cause of any delays and proposed recovery plans, concessions, internal and outsourced inspection and aud",,equipment,contract management information deliverables,IOGP S-615:2023,,,CFIHOS-70000300,progress report,No,No,Yes,,,,,,,,,PDF
CFIHOS-68001820,CFIHOS-30000521,centrifugal pump,CFIHOS-90000308,IOGP S-615:2023,S615-IR-23,Quality plan,Quality plan,"Plan specifying the actions, responsibilities and associated resources to be applied by the vendor, and when applicable sub-vendors or manufacturers, to deliver the services or procured item(s) in conformance with the agreed requirements. ISO 9001 Clause ",,equipment,contract management information deliverables,IOGP S-615:2023,,,CFIHOS-70000451,quality plan,No,No,No,,,,,,,,,PDF
CFIHOS-68001821,CFIHOS-30000521,centrifugal pump,CFIHOS-90000308,IOGP S-615:2023,S615-IR-24,Sub-vendor delivery schedule,Delivery/production schedule,"Definition of processes, products or services that will be externally provided and the controls to be applied by the vendor to ensure conformance with agreed requirements. The schedule includes evidence of the basis of capability assessment , quality mana",,equipment,contract management information deliverables,IOGP S-615:2023,,,CFIHOS-70000298,procurement schedule,Yes,No,Yes,,,,,,,,,Native
CFIHOS-68001822,CFIHOS-30000521,centrifugal pump,CFIHOS-90000308,IOGP S-615:2023,S615-IR-25,Inspection and test plan for complete package,Inspection and test plan (ITP),"Tabular presentation of a quality plan typically used for process or product applications to define the specific sequence of operational activities, instructions, acceptance criteria records and associated vendor, purchaser and independent conformity asse",,equipment,contract management information deliverables,IOGP S-615:2023,,,CFIHOS-70000180,inspection and test plan,Yes,Yes,No,,,,,,,,,PDF
CFIHOS-68001823,CFIHOS-30000521,centrifugal pump,CFIHOS-90000308,IOGP S-615:2023,S615-IR-26,"Handling, shipping, storage and preservation procedure","Handling, shipping and storage procedure","Definition of practices to be followed during the; storage, transport, lifting and preservation of the equipment and materials included in the scope of supply to maintain their functionality and guarantees. Procedures typically define: a) Packaging requir",,equipment,contract management information deliverables,"8.4.3.1, 8.4.3.7",,,CFIHOS-70000154,"handling, shipping, storage procedure",No,No,Yes,,,,,,,,,PDF
CFIHOS-68001824,CFIHOS-30000521,centrifugal pump,CFIHOS-90000308,IOGP S-615:2023,S615-IR-27,Non-conformance records,Non-conformance records,Details of non-conformances raised by or to the vendor/sub-vendors against technical requirements prior to or during the delivery of the products or services. Non-conformance is managed by the vendor in accordance with ISO 9001 Clause 8.7 and associated r,,equipment,contract management information deliverables,IOGP S-615:2023,,,CFIHOS-70000226,non conformance report,No,Yes,No,,,,,,,,,PDF
CFIHOS-68001825,CFIHOS-30000521,centrifugal pump,CFIHOS-90000308,IOGP S-615:2023,S615-IR-28,Concession requests,Concession request,"Formal submission seeking purchaser agreement to accept deviations from the contracted scope or technical requirements. Requests may be raised as a result of, as examples, material or service availability, obsolescence, innovation, non-conformance. Reques",,equipment,contract management information deliverables,IOGP S-615:2023,,,CFIHOS-70000389,technical deviation request,No,Yes,No,,,,,,,,,PDF
CFIHOS-68001826,CFIHOS-30000521,centrifugal pump,CFIHOS-90000308,IOGP S-615:2023,S615-IR-29,Pump performance curves,Curves and tables calculations,"As per the requirements of L.2.4 of API Standard 610, with the addition, as applicable, of the following: - all duty points, including the guarantee point; - all pump performance curves shall be based on running clearances selected by the vendor inclusive",,equipment,technical information deliverables,"6.1.13, 6.1.14, 6.1.15, 6.1.16, 6.1.4, 6.1.5, 8.3.3.4.6, 9.3.1.1, L2.4 paragraph 1 bullet a, L2.4 paragraph 1 bullet b, L2.4 paragraph 1 bullet c, L2.4 paragraph 1 bullet d, L2.4 paragraph 1 bullet e, L2.4 paragraph 1 sentence 1, L2.4 paragraph 1 sentence",,,CFIHOS-70000449,performance report,Yes,Yes,No,,,,,,,,,PDF
CFIHOS-68001827,CFIHOS-30000521,centrifugal pump,CFIHOS-90000308,IOGP S-615:2023,S615-IR-30,Noise data sheet,Noise data sheet,"For proposal: predicted overall package noise data including any noise attenuation devices (if included in the vendor's scope).For acceptance: noise data sheets including individual pump, driver, gear (if any) and auxiliary equipment octave band centre fr",,equipment,technical information deliverables,"6.1.19, 6.1.19.2, L.3.6.1, L.3.6.2, L2.3.2 paragraph 1 bullet b",,,CFIHOS-70000225,noise datasheet,Yes,No,Yes,,,,,,,,,PDF
CFIHOS-68001828,CFIHOS-30000521,centrifugal pump,CFIHOS-90000308,IOGP S-615:2023,S615-IR-33,Shaft and rotor total indicator (TIR) reading certificates,General certificate,"Certificates detailing all shaft run-out checks, including phase relation for each displacement probe location on pumps, motors, steam turbines and gear units.",,equipment,technical information deliverables,"6.6.10, 6.6.9, 7.1.8, 9.2.2.4, 9.3.12.2, 9.3.3.1, Figure 36, Table 17",,,CFIHOS-70000239,general certificate,No,No,No,,,,,,,,,PDF
CFIHOS-68001829,CFIHOS-30000521,centrifugal pump,CFIHOS-90000308,IOGP S-615:2023,S615-IR-34,Wear part running clearance certificates,General certificate,Certificates detailing all as-built close clearances and those specified at purchase.,,equipment,technical information deliverables,"6.7.5, 8.2.1.1, L.3.6.1, Table 6",,,CFIHOS-70000239,general certificate,No,No,No,,,,,,,,,PDF
CFIHOS-68001830,CFIHOS-30000521,centrifugal pump,CFIHOS-90000308,IOGP S-615:2023,S615-IR-35,Torsional critical speed analysis,Torsional critical speed analysis,"As per the requirements of section 6.9.2.8 of API Standard 610 when only a steady-state, undamped torsional analysis is performed as per the requirements of sections 6.9.2.9 through 6.9.2.13 of API Standard 610 when either a steady-state forced response a",,equipment,technical information deliverables,"6.9.2.10, 6.9.2.11, 6.9.2.12, 6.9.2.13, 6.9.2.3, 6.9.2.4, 6.9.2.6, 6.9.2.7, 6.9.2.8, 6.9.2.9, L.3.6.1",,,CFIHOS-70000449,performance report,No,Yes,No,,,,,,,,,PDF
CFIHOS-68001831,CFIHOS-30000521,centrifugal pump,CFIHOS-90000308,IOGP S-615:2023,S615-IR-36,Performance and mechanical run test data,Test report,"As per the requirements of sections L.3.6.1 u) together with sections 6.9.4, 6.10.2.7, 8.3.3, 8.3.4 and C.4 of API Standard 610/S-615.",,equipment,technical information deliverables,"6.1.22, 6.10.2.7, 8.3.3.3.1, 8.3.3.4.3, 8.3.3.4.5, 8.3.3.6.2, 8.3.3.7, 8.3.3.8.1, 8.3.3.8.2, 8.3.4.2.1, 9.3.9.1, 6.9.4.2, 6.9.4.3, 6.9.4.4, 6.9.4.5, 6.9.4.6, 6.9.4.7, 6.9.4.8, 6.9.4.9, 8.2.1.1, 8.3.1.2, 8.3.1.4, 8.3.1.5, 8.3.3.2, 8.3.3.2.1, 8.3.3.2.2, 8.3",,,CFIHOS-70000245,inspection report,No,Yes,No,,,,,,,,,PDF
CFIHOS-68001832,CFIHOS-30000521,centrifugal pump,CFIHOS-90000308,IOGP S-615:2023,S615-IR-37,Rotating component balancing certificates,General certificate,The certificate to be provided by the manufacturer recording the results of the balancing of all rotating elements to the specified grade in accordance with the purchaser accepted balancing procedure. To include residual unbalance check.,,equipment,technical information deliverables,"8.3.3.8.1, 8.3.3.8.2, 6.12.1.10, 6.12.1.11, 6.9.3.1, 6.9.3.2, 6.9.3.3, 6.9.3.4, 6.9.3.5, 7.2.2, 9.1.3.6, 9.2.4.2.1, 9.2.4.2.2, 9.2.4.2.3, 9.2.4.2.4, Figure 30, Table 19",,,CFIHOS-70000239,general certificate,No,No,No,,,,,,,,,PDF
CFIHOS-68001833,CFIHOS-30000521,centrifugal pump,CFIHOS-90000308,IOGP S-615:2023,S615-IR-38,Non-destructive examination records,Non-destructive examination (NDE) report,"Detailed non-destructive examination reports describing procedure used, results obtained and action for visual, radiographic, ultrasonic, magnetic particle, and dye-penetrant examinations. Reports shall be signed and dated by an authorized operator and id",,equipment,technical information deliverables,"6.12.3.3, 6.12.3.4, 6.12.3.4.1, 6.4.3.10, 8.2.2.1, 8.2.2.2, 8.2.2.3.1, 8.2.2.3.2, 8.2.2.3.3, 8.2.2.4, 8.2.2.5, 9.3.2.5, 9.3.2.6, Table 11, Table 15",,,CFIHOS-70000446,non destructive test report,No,No,No,,,,,,,,,PDF
CFIHOS-68001834,CFIHOS-30000521,centrifugal pump,CFIHOS-90000308,IOGP S-615:2023,S615-IR-39,Material certificates,Materials inspection certificate (3.1),"Certificate type shall be as required by the QRS/project requirements. Material test certificates shall include as a minimum chemical analysis, mechanical test results and heat treatment condition, sour service when specified in the procurement data sheet",,equipment,technical information deliverables,"6.12.1.8, 6.12.3.4, 8.2.1.1, L.3.6.1, Table H.2, Table H.4",,,CFIHOS-70000412,material certificate,No,Yes,No,,,,,,,,,PDF
CFIHOS-68001835,CFIHOS-30000521,centrifugal pump,CFIHOS-90000308,IOGP S-615:2023,S615-IR-40,Weld procedures and procedure qualification records,Welding procedure qualification record,"Factory and foundry WPSs and PQRs proposed for each different weld and materials. For proposed major weld repairs, weld repair maps showing location and major dimensions of weld repair cavities, qualification records, drawings, photographs, heat treatment",Owners approval required for major weld repair procedures,equipment,technical information deliverables,"6.12.2.5, 6.12.3.1, 6.4.3.10, 6.6.15.1, L.3.6.1, Table 11",,,CFIHOS-70000362,welding procedure qualification,No,No,No,,,,,,,,,PDF
CFIHOS-68001836,CFIHOS-30000521,centrifugal pump,CFIHOS-90000308,IOGP S-615:2023,S615-IR-41,Surface preparation and painting inspection certificates,Painting and coating inspection records,"Certification confirming that the unpainted equipment meets the visual requirements of MSS SP-55.Certificate to include purchaser's PO number; item or tag number, and shall verify that painting and/or insulation is in accordance with the purchaser's speci",Information required to ensure surface preparation and painting comply with the specified requirements,equipment,technical information deliverables,"9.3.8.3.2, 6.12.2.1, 7.4.16, 8.4.3.4",,,CFIHOS-70000245,inspection report,No,No,No,,,,,,,,,PDF
CFIHOS-68001837,CFIHOS-30000521,centrifugal pump,CFIHOS-90000308,IOGP S-615:2023,S615-IR-42,Casting major weld repair records,Weldability test report,Records to include: defect map and records to confirm defect type and location; NDT reports to confirm defect removal; WPS & qualification records used for repair; welding records to verify welder qualification and weld repair procedure parameter conforma,,equipment,technical information deliverables,"6.12.2.5, 8.2.1.1, Table 11",,,CFIHOS-70000245,inspection report,No,Yes,No,,,,,,,,,PDF
CFIHOS-68001838,CFIHOS-30000521,centrifugal pump,CFIHOS-90000308,IOGP S-615:2023,S615-IR-43,Welders qualifications,Welder qualification certificate,"Qualification of all welders or welding operators using approved weld procedures and by weld position in accordance with project specifications. Welders name, identification and positions to be recorded to code requirements with approval by third party in",,equipment,technical information deliverables,"6.12.2.5, 6.12.3.1, 6.4.3.10, 6.6.15.1, Table 11",,,CFIHOS-70000413,welder qualification certificate,No,No,No,,,,,,,,,PDF
CFIHOS-68001839,CFIHOS-30000521,centrifugal pump,CFIHOS-90000308,IOGP S-615:2023,S615-IR-44,Heat treatment certificates,Heat treatment records,Scanned Original or wet stamped verified copies of pyrometric charts or certificates confirming the heat treatment cycles have been conducted to the purchaser's/material specification's requirements. To include charts for any heat treatment conducted such,,equipment,technical information deliverables,"6.12.2.5, 6.12.3.3, 6.12.1.14.1, 6.12.3.4, 6.4.3.10, 8.2.1.1, Table 11",,,CFIHOS-70000423,heat treatment records,No,No,No,,,,,,,,,PDF
CFIHOS-68001840,CFIHOS-30000521,centrifugal pump,CFIHOS-90000308,IOGP S-615:2023,S615-IR-45,Nameplate drawing,Name plate drawing,Nameplate data content is to be as per API Standard 610/S-615 section 6.13.2. Nameplate language per PO.,,equipment,technical information deliverables,6.13.2,,,CFIHOS-70000445,name plate diagram,No,Yes,No,,,,,,,,,PDF
CFIHOS-68001841,CFIHOS-30000521,centrifugal pump,CFIHOS-90000308,IOGP S-615:2023,S615-IR-46,Baseplate flatness and coplanarity certificates,General certificate,Certification confirming that all the machinery mounting pads of the baseplate have been fully machined flat and parallel to each other per the requirements of API Standard 610.,,equipment,technical information deliverables,"7.4.8, 9.3.8.3.1",,,CFIHOS-70000239,general certificate,No,No,No,,,,,,,,,PDF
CFIHOS-68001842,CFIHOS-30000521,centrifugal pump,CFIHOS-90000308,IOGP S-615:2023,S615-IR-49,Positive material identification certificates,Positive material identification (PMI) records,Certification that the alloying element percentages of materials subject to verification are in accordance with the proposed recognised material specification.,,equipment,technical information deliverables,"8.2.2.8, 6.4.3.10",,,CFIHOS-70000245,inspection report,No,No,Yes,,,,,,,,,PDF
CFIHOS-68001843,CFIHOS-30000521,centrifugal pump,CFIHOS-90000308,IOGP S-615:2023,S615-IR-50,Performance and mechanical run test procedures,Factory acceptance test (FAT) procedure,"Procedure for performance and mechanical run testing as per the requirements of sections 6.9.4, 6.10.2.7, 8.1.1, 8.3.1, 8.3.3, 8.3.4, 9.3.9 and C.4 of API Standard 610/S-615 with the following change:- add description of the test setup and instrumentation",,equipment,technical information deliverables,"6.1.22, 6.10.2.7, 7.2.2, 8.3.3.3.1, 8.3.3.4.3, 8.3.3.4.5, 8.3.3.4.6 , 8.3.3.6.2, 8.3.3.7, 8.3.3.8.1, 8.3.3.8.2, 8.3.4.2.1, 9.3.9.1, 6.9.4.2, 6.9.4.3, 6.9.4.4, 6.9.4.5, 6.9.4.6, 6.9.4.7, 6.9.4.8, 6.9.4.9, 8.2.1.1, 8.3.1.2, 8.3.1.4, 8.3.1.5, 8.3.3.2, 8.3.3.",,,CFIHOS-70000427,factory acceptance test procedure,No,No,Yes,,,,,,,,,PDF
