CFIHOS unique code,property name,property definition,property data type,property data type length,unit of measure dimension code CFIHOS unique code,unit of measure dimension code,property picklist name CFIHOS unique code,property picklist name,property existence reason description,property synonym name,in model
CFIHOS-40000001,actual length,The actual length of the functional or physical object.,Number,,CFIHOS-45000011,LENGTH,,,,,True
CFIHOS-40000002,actuator motion,A general description of the mechanical operation of the actuator. For example is it linear or rotary? Electric or hydraulic?,Text,40,,,CFIHOS-50000001,actuator motion,,,True
CFIHOS-40000003,actuator seal material,The material of construction of the piston 'O' ring seal of an actuator.,Text,100,,,CFIHOS-50000002,actuator seal material,,,True
CFIHOS-40000004,adjustment ring material specification,Is a specification which describes the applicable materials for one or more items.,Text,100,,,CFIHOS-50000073,material specification,,,True
CFIHOS-40000005,air cooler type,Is a subtype of air cooler,Text,40,,,CFIHOS-50000003,air cooler type,,,True
CFIHOS-40000006,air preheater type,Is a subtype of preheater,Text,40,,,CFIHOS-50000083,preheater type,,,True
CFIHOS-40000007,anti corrosion coating thickness,The total anti corrosion coating system thickness.,Number,,CFIHOS-45000011,LENGTH,,,,,True
CFIHOS-40000008,anti corrosion coating type,The type of anti corrosion coating system.,Text,40,,,,,,,True
CFIHOS-40000009,ATEX category,Specify in which category the physical object is divided in accordance with the directive 94/9/EC.,Text,40,,,CFIHOS-50000005,ATEX category,,,True
CFIHOS-40000010,ATEX explosive atmosphere,Specify in which explosive atmosphere the physical object is divided in accordance with the directive 94/9/EC.,Text,40,,,CFIHOS-50000006,ATEX explosive atmosphere,,,True
CFIHOS-40000011,ATEX group,Specify in which group the physical object is divided in accordance with the directive 94/9/EC.,Text,40,,,CFIHOS-50000007,ATEX group,,,True
CFIHOS-40000012,autonomy time,The duration   of time during which a functional or physical object is designed to deliver its rated output under specified conditions.,Number,,CFIHOS-45000031,TIME,,,,,True
CFIHOS-40000013,bare tube outside surface area,Is an area located on a surface.,Number,,CFIHOS-45000026,SURFAC,,,,,True
CFIHOS-40000014,basic impulse level,The dielectric insulation gradient of a material tested to withstand the defined voltage stresses.,Number,,CFIHOS-45000038,VOLTAG,,,,,True
CFIHOS-40000015,battery construction,Describe whether the battery is a vented construction or sealed.,Text,40,,,CFIHOS-50000008,battery construction,,,True
CFIHOS-40000016,bellows material specification,Is a specification which describes the applicable materials for one or more items.,Text,100,,,CFIHOS-50000073,material specification,,,True
CFIHOS-40000017,body material,Is a possessed aspect being a role of the substance of an artefact when used to construct the artefact from. Therefore the substance should be in a solid state at the conditions at which the artefact exists.,Text,100,,,CFIHOS-50000070,material,,,True
CFIHOS-40000018,body material specification,Is a specification which describes the applicable materials for one or more items.,Text,100,,,CFIHOS-50000073,material specification,,,True
CFIHOS-40000019,boiler type,Is a subtype of boiler,Text,40,,,CFIHOS-50000009,boiler type,,,True
CFIHOS-40000020,bottom plates corrosion allowance,Is a thickness that is a bonus on a wall thickness to compensate for expected corrosion.,Number,,CFIHOS-45000011,LENGTH,,,,,True
CFIHOS-40000021,bottom plates material specification,Is a specification which describes the applicable materials for one or more items.,Text,100,,,CFIHOS-50000073,material specification,,,True
CFIHOS-40000022,bottom section inside diameter,Is an inside diameter of an item that is the prime inside diameter in case the item has more than one inside diameter.,Number,,CFIHOS-45000011,LENGTH,,,,,True
CFIHOS-40000023,bottom section length,Is a distance measured in the direction of the longest side of an item or in the direction of its main axis.,Number,,CFIHOS-45000011,LENGTH,,,,,True
CFIHOS-40000024,bottom section lower limit operating pressure,Is a pressure that is a minimum possible or allowed or occurring or required.,Number,,CFIHOS-45000017,PRESS,,,,,True
CFIHOS-40000025,bottom section lower limit operating temperature,The temperature which is the lowest temperature at  which a functional or physical object is expected to operate.,Number,,CFIHOS-45000028,TEMP,,,,,True
CFIHOS-40000026,bottom section normal operating pressure,The pressure at which a functional or physical object is expected to operate normally.,Number,,CFIHOS-45000017,PRESS,,,,,True
CFIHOS-40000027,bottom section normal operating temperature,The temperature at which a functional or physical object is expected to operate normally.,Number,,CFIHOS-45000028,TEMP,,,,,True
CFIHOS-40000028,bottom section upper limit operating temperature,The temperature which is the highest temperature at which a functional or physical object is expected to operate.,Number,,CFIHOS-45000028,TEMP,,,,,True
CFIHOS-40000029,breaking capacity,The current that a fuse or circuit breaker is able to interrupt without being destroyed or causing an electric arc with unacceptable duration.,Number,,CFIHOS-45000007,ECURR,,,,,True
CFIHOS-40000030,buried,"Is the functional item buried, yes/no?",Boolean,3,,,,,,,True
CFIHOS-40000031,burner type,Is a subtype of burner,Text,40,,,CFIHOS-50000010,burner type,,,True
CFIHOS-40000032,cable cross sectional area,The cross sectional area of the cable cores,Number,,CFIHOS-45000026,SURFAC,,,,,True
CFIHOS-40000033,cable specification,"The designation which defines the specification of the cable in accordance with national or international standards. (Example on cable specification according to Cenelec HD 361: H07 VV-F 10x1,5)",Text,40,,,,,,,True
CFIHOS-40000034,cable type,The code describing the construction of the cable.,Text,40,,,CFIHOS-50000145,cable type,,,True
CFIHOS-40000035,capacitor bank cooling method,The main method of cooling of a capacitor bank.,Text,40,,,CFIHOS-50000011,capacitor bank cooling method,,,True
CFIHOS-40000036,capacity control range,Specify the reduced capacity in percent.,Number,,CFIHOS-45000044,VPROPO,,,,,True
CFIHOS-40000037,channel corrosion allowance,Is a thickness that is a bonus on a wall thickness to compensate for expected corrosion.,Number,,CFIHOS-45000011,LENGTH,,,,,True
CFIHOS-40000038,channel material,The material from which the channel is constructed.,Text,100,,,CFIHOS-50000070,material,,,True
CFIHOS-40000039,chemical cleaning required,Specify if the functional or physical object requires chemical cleaning.,Boolean,3,,,,,,,True
CFIHOS-40000040,chloride concentration,Specifies the level of chloride in the liquid.,Number,,CFIHOS-45000015,MPROPO,,,,,True
CFIHOS-40000041,coating specification,Is a material specification for a coating.,Text,40,,,CFIHOS-50000013,coating material,,,True
CFIHOS-40000042,coil normal operating pressure,The pressure at which a functional or physical object is expected to operate normally.,Number,,CFIHOS-45000017,PRESS,,,,,True
CFIHOS-40000043,coil normal operating temperature,The temperature at which a functional or physical object is expected to operate normally.,Number,,CFIHOS-45000028,TEMP,,,,,True
CFIHOS-40000044,coil upper limit design pressure,The highest pressure at which a functional or physical object is designed for.,Number,,CFIHOS-45000017,PRESS,,,,,True
CFIHOS-40000045,cold differential test pressure,Is the pressure at which the pressure relief valve is adjusted to open on the bench. It includes corrections for back pressure and/or temperature,Number,,CFIHOS-45000017,PRESS,,,,,True
CFIHOS-40000046,cold side fluid name,The name of the product in liquid or gas phase.,Text,100,,,CFIHOS-50000051,fluid,,,True
CFIHOS-40000047,cold side maximum allowable working pressure new and cold,Is an allowable operating pressure that is the maximum pressure to which a container is allowed to be exposed during operating conditions when the item is new and cold.,Number,,CFIHOS-45000017,PRESS,,,,,True
CFIHOS-40000048,cold side minimum design metal temperature,"Is a temperature that is the lowest at which a significant load can be applied. Typically applied to a pressure vessel. Defined by the ASME Code, Section VIII, Division 1, paragraph UG-20 (see Section 3).",Number,,CFIHOS-45000028,TEMP,,,,,True
CFIHOS-40000049,cold side normal operating inlet pressure,The pressure at which a functional or physical object is expected to operate normally.,Number,,CFIHOS-45000017,PRESS,,,,,True
CFIHOS-40000050,cold side normal operating inlet temperature,Is a temperature that occurs during operation or under which an object is supposed to operate.,Number,,CFIHOS-45000028,TEMP,,,,,True
CFIHOS-40000051,cold side normal operating outlet pressure,The pressure at which a functional or physical object is expected to operate normally.,Number,,CFIHOS-45000017,PRESS,,,,,True
CFIHOS-40000052,cold side normal operating outlet temperature,Is a temperature that occurs during operation or under which an object is supposed to operate.,Number,,CFIHOS-45000028,TEMP,,,,,True
CFIHOS-40000053,cold side number of passes,Is a number of items where each item is a tube pass.,Number,,CFIHOS-45000037,COUNT,,,,,True
CFIHOS-40000054,cold side test medium,The medium used for testing purpose.,Text,40,,,CFIHOS-50000100,test medium,,,True
CFIHOS-40000055,cold side test pressure,The pressure to which a functional or physical object should be subjected to test for leakage and structural integrity.,Number,,CFIHOS-45000017,PRESS,,,,,True
CFIHOS-40000056,cold side upper limit design pressure,The highest pressure at which a functional or physical object is designed for.,Number,,CFIHOS-45000017,PRESS,,,,,True
CFIHOS-40000057,cold side upper limit operating temperature,The temperature which is the highest temperature at which a functional or physical object is expected to operate.,Number,,CFIHOS-45000028,TEMP,,,,,True
CFIHOS-40000058,component cooling requirement,Specify the component which require cooling.,Text,40,,,CFIHOS-50000015,cooling on,,,True
CFIHOS-40000059,component cooling type,Specify the preferred type of cooling.,Text,40,,,CFIHOS-50000016,cooling type,,,True
CFIHOS-40000060,compressibility factor Z at inlet,The compressibility (Z) factor for the process medium at inlet conditions,Number,,CFIHOS-45000044,VPROPO,,,,,True
CFIHOS-40000061,compressor capacity control type,Specify the type of capacity control.,Text,40,,,CFIHOS-50000012,capacity control,,,True
CFIHOS-40000062,connection symbol,A nomenclature provides important information about the way in which three phase windings are connected and any phase displacement that occurs,Text,40,,,,,,,True
CFIHOS-40000063,controlled property,"Provide a general description of the physical property that the instrument loop is measuring and controlling. For example pressure, flow, temperature etc",Text,40,,,CFIHOS-50000014,controlled property,,,True
CFIHOS-40000064,corrosive agents,Specify which corrosive agents are present in the process fluid.,Text,40,,,,,,,True
CFIHOS-40000065,corrosive gas,Specify if the gas is corrosive.,Boolean,3,,,,,,,True
CFIHOS-40000066,corrosive liquid,Specify if the liquid contains corrosive agents.,Boolean,3,,,,,,,True
CFIHOS-40000067,coupling type,"A general description of the type of coupling to the drive shaft of an equipment item. For example fixed, flexible, disconnected etc",Text,40,,,CFIHOS-50000018,coupling type,,,True
CFIHOS-40000068,crane type,"Give a general description of the type of crane. For example gantry crane, pedestal crane etc",Text,40,,,CFIHOS-50000019,crane type,,,True
CFIHOS-40000069,crankcase rapid pressure relief device,Specify if the crankcase shall have a pressure relief device.,Boolean,3,,,,,,,True
CFIHOS-40000070,critical line,Specifies if the design for the line requires some special attention.,Boolean,3,,,,,,,True
CFIHOS-40000071,critical pipeline,Pipelines where the linepipe is specified as ISO-3183 class 2 or 3.,Boolean,3,,,,,,,True
CFIHOS-40000072,cylinder head cooling method,The method of cooling of the cylinder head of the equipment item.,Text,40,,,CFIHOS-50000022,cylinder head cooling method type,,,True
CFIHOS-40000073,cylinder lubricator type,Specify the type of lubricator for the cylinder.,Text,40,,,,,,,True
CFIHOS-40000074,design tube metal temperature,Is a temperature for which an item is designed to withstand the design pressure. It is typically derived from various normal and possible abnormal operating conditions.,Number,,CFIHOS-45000028,TEMP,,,,,True
CFIHOS-40000075,direction of rotation,Specify the direction of rotation of the functional or physical object.,Text,40,,,CFIHOS-50000024,direction of rotation,,,True
CFIHOS-40000076,disc holder material,Is a possessed aspect being a role of the substance of an artefact when used to construct the artefact from. Therefore the substance should be in a solid state at the conditions at which the artefact exists.,Text,100,,,CFIHOS-50000070,material,,,True
CFIHOS-40000077,disc material,Is a possessed aspect being a role of the substance of an artefact when used to construct the artefact from. Therefore the substance should be in a solid state at the conditions at which the artefact exists.,Text,100,,,CFIHOS-50000070,material,,,True
CFIHOS-40000078,disc material specification,Is a specification which describes the applicable materials for one or more items.,Text,100,,,CFIHOS-50000073,material specification,,,True
CFIHOS-40000079,downcomer corrosion allowance,Is a thickness that is a bonus on a wall thickness to compensate for expected corrosion.,Number,,CFIHOS-45000011,LENGTH,,,,,True
CFIHOS-40000080,downcomer length,Is a distance measured in the direction of the longest side of an item or in the direction of its main axis.,Number,,CFIHOS-45000011,LENGTH,,,,,True
CFIHOS-40000081,downcomer material,Is a possessed aspect being a role of the substance of an artefact when used to construct the artefact from. Therefore the substance should be in a solid state at the conditions at which the artefact exists.,Text,100,,,CFIHOS-50000070,material,,,True
CFIHOS-40000082,downcomer number of tubes,Is a number of items where each item is a tube.,Number,,CFIHOS-45000037,COUNT,,,,,True
CFIHOS-40000083,downcomer outside diameter,Is an outside diameter of an item that is the prime outside diameter in case the item has more than one outside diameter.,Number,,CFIHOS-45000011,LENGTH,,,,,True
CFIHOS-40000084,downcomer wall thickness,Is a thickness according to a design.,Number,,CFIHOS-45000011,LENGTH,,,,,True
CFIHOS-40000085,driven unit normal operating shaft power,The shaft power under rated conditions for the equipment which is driven by the functional or physical object.,Number,,CFIHOS-45000016,POWER,,,,,True
CFIHOS-40000086,driven unit normal speed,The rotational speed which is the normal operating speed for the equipment which is driven  by the functional or physical object.,Number,,CFIHOS-45000036,ANGVEL,,,,,True
CFIHOS-40000087,driver type,"A general description of the device that produces the mechanical or electrical power that runs the equipment. For example diesel engine, electric motor, gas turbine etc.",Text,40,,,CFIHOS-50000030,driver type,,,True
CFIHOS-40000088,duty of electronic power inverter,Specify the duty of the electronic power inverter.,Text,40,,,CFIHOS-50000077,operation continuous intermittent,,,True
CFIHOS-40000089,duty of synchronous AC machines,Specify the duty of the synchronous AC machine.,Text,40,,,CFIHOS-50000077,operation continuous intermittent,,,True
CFIHOS-40000090,economizer corrosion allowance,Is a thickness that is a bonus on a wall thickness to compensate for expected corrosion.,Number,,CFIHOS-45000011,LENGTH,,,,,True
CFIHOS-40000091,economizer effective outside surface area,Is an area located on a surface.,Number,,CFIHOS-45000026,SURFAC,,,,,True
CFIHOS-40000092,economizer material,Is a possessed aspect being a role of the substance of an artefact when used to construct the artefact from. Therefore the substance should be in a solid state at the conditions at which the artefact exists.,Text,100,,,CFIHOS-50000070,material,,,True
CFIHOS-40000093,economizer number of tubes,Is a number of items where each item is a tube.,Number,,CFIHOS-45000037,COUNT,,,,,True
CFIHOS-40000094,economizer tube length,Is a distance measured in the direction of the longest side of an item or in the direction of its main axis.,Number,,CFIHOS-45000011,LENGTH,,,,,True
CFIHOS-40000095,economizer tube outside diameter,Is an outside diameter of an item that is the prime outside diameter in case the item has more than one outside diameter.,Number,,CFIHOS-45000011,LENGTH,,,,,True
CFIHOS-40000096,economizer wall thickness,Is a thickness according to a design.,Number,,CFIHOS-45000011,LENGTH,,,,,True
CFIHOS-40000097,electric generator cooling method,The method of cooling used by a electrical synchronous machine.,Text,40,,,CFIHOS-50000031,electric generator cooling method,,,True
CFIHOS-40000098,bearing lubrication,The method of lubrication of the bearings.,Text,40,,,CFIHOS-50000032,electric motor bearing lubrication,,,True
CFIHOS-40000099,electric motor cooling method,The method of cooling used by a electric motor.,Text,40,,,CFIHOS-50000033,electric motor cooling method,,,True
CFIHOS-40000100,electrical plug type,Specify the type of electrical plug.,Text,40,,,CFIHOS-50000035,electrical plug type,,,True
CFIHOS-40000101,electrical transformer type,The insulation medium used inside the physical object.,Text,40,,,CFIHOS-50000036,electrical transformer type,,,True
CFIHOS-40000102,emergency upper limit design temperature,"The maximum temperature that can be reached under unintended, but possible, emergency conditions other than external fires.",Number,,CFIHOS-45000028,TEMP,,,,,True
CFIHOS-40000103,end connections,Is the fittings by means of which expansion joints are connected to the piping system or to equipment.,Text,40,,,CFIHOS-50000037,end connections,,,True
CFIHOS-40000104,erosive liquid,Specify if the liquid contains erosive agents.,Boolean,3,,,,,,,True
CFIHOS-40000105,estimated equivalent length,The virtual length of the functional or physical object that would produce the same pressure drop than the real object.,Number,,CFIHOS-45000011,LENGTH,,,,,True
CFIHOS-40000106,estimated length,The estimated length of the functional or physical object. Can be used to estimate the weight of the object.,Number,,CFIHOS-45000011,LENGTH,,,,,True
CFIHOS-40000107,expansion joint type,Is a subtype of expansion joint,Text,40,,,CFIHOS-50000040,expansion joint type,,,True
CFIHOS-40000108,explosion protection concept,Specify the identification of electrical equipment's explosion protection and type of ignition protection in accordance with IEC/EN 60079-0.,Text,40,,,,,,,True
CFIHOS-40000109,explosion protection examination certificate number,The examination certificate number for the physical object issued by a notified body.,Text,40,,,,,,,True
CFIHOS-40000110,explosion protection gas group,Specify the gas group classification of the physical object in accordance with IEC/EN 60079-20,Text,40,,,CFIHOS-50000043,explosion protection gas group,,,True
CFIHOS-40000111,explosion protection notified body,The name of the nationally accredited approval body that has issued the examination certificate for the physical object.,Text,40,,,,,,,True
CFIHOS-40000112,explosion protection temperature class,Specify the temperature classification of the physical object in accordance with CENELEC EN50014,Text,40,,,CFIHOS-50000045,explosion protection temperature class,,,True
CFIHOS-40000113,explosion protection zone,Specify the hazardous zone in which the functional or physical object is expected to operate.,Text,40,,,CFIHOS-50000116,zone,,,True
CFIHOS-40000114,external insulation type,The type of insulation of a functional or physical object.,Text,40,,,CFIHOS-50000060,insulation type,,,True
CFIHOS-40000115,external maximum allowable working pressure new and cold,Is an allowable operating pressure that is the maximum pressure to which a container is allowed to be exposed during operating conditions when the item is new and cold.,Number,,CFIHOS-45000017,PRESS,,,,,True
CFIHOS-40000116,external operating pressure,The pressure at which a functional or physical object is expected to operate normally.,Number,,CFIHOS-45000017,PRESS,,,,,True
CFIHOS-40000117,external operating temperature,Is a temperature that occurs during operation or under which an object is supposed to operate.,Number,,CFIHOS-45000028,TEMP,,,,,True
CFIHOS-40000118,external test pressure,The pressure to which a functional or physical object should be subjected to test for leakage and structural integrity.,Number,,CFIHOS-45000017,PRESS,,,,,True
CFIHOS-40000119,external upper limit design pressure,The highest pressure at which a functional or physical object is designed for.,Number,,CFIHOS-45000017,PRESS,,,,,True
CFIHOS-40000120,extraction of steam controlled,"Specifies if the extraction of the steam is controlled with a valve, or left uncontrolled.",Boolean,3,,,,,,,True
CFIHOS-40000121,finned outside surface area,Is an area located on a surface.,Number,,CFIHOS-45000026,SURFAC,,,,,True
CFIHOS-40000122,flammable liquid,Specifies if the liquid is flammable.,Boolean,3,,,,,,,True
CFIHOS-40000123,flanges material specification,Is a specification which describes the applicable materials for one or more items.,Text,100,,,CFIHOS-50000073,material specification,,,True
CFIHOS-40000124,floating roof seal type,Specify the type of seal for a floating roof for the functional or physical tank.,Text,40,,,CFIHOS-50000049,floating roof seal type,,,True
CFIHOS-40000125,floor material,The material from which the floor is constructed or an additional covering to strengthen or protect the surface of the floor structure.,Text,100,,,CFIHOS-50000070,material,,,True
CFIHOS-40000126,flowline type,"The purpose of a flow line. For example 'gas production', oil production', 'water injection', 'gas injection' etc.",Text,40,,,CFIHOS-50000050,flowline type,,,True
CFIHOS-40000127,flue gas duct height,The maximum height of a functional or physical object above its base when installed.,Number,,CFIHOS-45000011,LENGTH,,,,,True
CFIHOS-40000128,flue gas duct lining material,Is a material of construction of which a lining is made.,Text,100,,,CFIHOS-50000067,lining material,,,True
CFIHOS-40000129,flue gas ducting material,Is a possessed aspect being a role of the substance of an artefact when used to construct the artefact from. Therefore the substance should be in a solid state at the conditions at which the artefact exists.,Text,100,,,CFIHOS-50000070,material,,,True
CFIHOS-40000130,flue gas ducting material specification,Is a specification which describes the applicable materials for one or more items.,Text,100,,,CFIHOS-50000073,material specification,,,True
CFIHOS-40000131,flue gas ducting thickness,Is a thickness according to a design.,Number,,CFIHOS-45000011,LENGTH,,,,,True
CFIHOS-40000132,fluid name,The name of the product in liquid or gas phase.,Text,100,,,CFIHOS-50000051,fluid,,,True
CFIHOS-40000133,fluid phase,"Specify if the fluid is in liquid, gas or both phases.",Text,40,,,CFIHOS-50000052,fluid phase,,,True
CFIHOS-40000134,frame size,Dimensions and output series for rotating electrical machines in conformity with IEC 60072,Text,40,,,,,,,True
CFIHOS-40000135,fuel type,"The type of fuel required by an equipment item. For example 'fuel gas, diesel etc.",Text,40,,,CFIHOS-50000053,fuel type,,,True
CFIHOS-40000136,full vacuum,Specifies if the internal of the functional or physical object can have an extremely low gas pressure relative to the surrounding pressure.,Boolean,3,,,,,,,True
CFIHOS-40000137,gas analysed,The chemical symbols of the gases/chemicals that the detector/analyser is capable of detecting. Chemical symbols are preferred to actual names.,Text,40,,,,,,,True
CFIHOS-40000138,gas turbine type,Specify whether the turbine is an aero derivative turbine or an industrial turbine type.,Text,40,,,CFIHOS-50000105,turbine type,,,True
CFIHOS-40000139,gas turbine waste heat utilization,Specify if the functional or physical object is equipped with an exhaust heat recovery system.,Boolean,3,,,,,,,True
CFIHOS-40000140,gear box type,"Specify whether the gearbox is intended to increase or decrease the speed, or both.",Text,40,,,CFIHOS-50000055,gearbox type,,,True
CFIHOS-40000141,gearwheel type,A general description of the construction of the gear wheels in an equipment item.,Text,40,,,CFIHOS-50000054,gear wheel type,,,True
CFIHOS-40000142,H2S concentration,Specifies the level of H2S in the fluid.,Number,,CFIHOS-45000015,MPROPO,,,,,True
CFIHOS-40000144,head corrosion allowance,Is a thickness that is a bonus on a wall thickness to compensate for expected corrosion.,Number,,CFIHOS-45000011,LENGTH,,,,,True
CFIHOS-40000145,head external corrosion allowance,Is a thickness that is a bonus on a wall thickness to compensate for expected corrosion.,Number,,CFIHOS-45000011,LENGTH,,,,,True
CFIHOS-40000146,head internal corrosion allowance,Is a thickness that is a bonus on a wall thickness to compensate for expected corrosion.,Number,,CFIHOS-45000011,LENGTH,,,,,True
CFIHOS-40000147,head lining material,Is a material of construction of which a lining is made.,Text,100,,,CFIHOS-50000067,lining material,,,True
CFIHOS-40000148,head material,Is a possessed aspect being a role of the substance of an artefact when used to construct the artefact from. Therefore the substance should be in a solid state at the conditions at which the artefact exists.,Text,100,,,CFIHOS-50000070,material,,,True
CFIHOS-40000149,head material specification,Is a specification which describes the applicable materials for one or more items.,Text,100,,,CFIHOS-50000073,material specification,,,True
