CFIHOS-40000717,power recovery,Specify if the unit has power recovery.,Boolean,,,,,,Required by owner-operators,,True
CFIHOS-40000718,rotary compressor type,Is a subtype of rotary compressor,Text,40,,,CFIHOS-50000189,rotary compressor type,Required by owner-operators,,True
CFIHOS-40000719,shutdown required for internal entry,Specify if shutdown is required for an internal entry.,Boolean,,,,,,Required by owner-operators,,True
CFIHOS-40000720,steam turbine type,Is a subtype of steam turbine,Text,50,,,CFIHOS-50000190,steam turbine type,Required by owner-operators,,True
CFIHOS-40000721,for subsea operations,Specify if the equipment is for subsea operations.,Boolean,,,,,,Required by owner-operators,,True
CFIHOS-40000722,subsea control module type,Is a subtype of subsea control module,Text,40,,,CFIHOS-50000191,subsea control module type,Required by owner-operators,,True
CFIHOS-40000723,swivel type,Is a subtype of swivel,Text,30,,,CFIHOS-50000192,swivel type,Required by owner-operators,,True
CFIHOS-40000724,truck type,Is a subtype of truck,Text,50,,,CFIHOS-50000193,truck type,Required by owner-operators,,True
CFIHOS-40000725,tube bwg,Specify the tube thickness using the Birmingham wire gauge.,Text,,,,,,Required by owner-operators,,True
CFIHOS-40000726,turbo expander type,Is a subtype of turbo expander,Text,20,,,CFIHOS-50000194,turbo expander type,Required by owner-operators,,True
CFIHOS-40000727,turret type,Is a subtype of turret,Text,30,,,CFIHOS-50000195,turret type,Required by owner-operators,,True
CFIHOS-40000728,type of gas detection,Is a subtype of gas detection,Text,30,,,CFIHOS-50000196,type of gas detection,Required by owner-operators,,True
CFIHOS-40000729,UPS type,Is a subtype of UPS,Text,40,,,CFIHOS-50000197,UPS type,Required by owner-operators,,True
CFIHOS-40000730,vehicle type,Is a subtype of vehicle,Text,30,,,CFIHOS-50000198,vehicle type,Required by owner-operators,,True
CFIHOS-40000731,voltage level,One of the nominal voltage values used in a given system.,Text,,,,,,Required by owner-operators,,True
CFIHOS-40000732,type of nozzle,Is a subtype of nozzle,Text,20,,,CFIHOS-50000199,type of nozzle,Required by owner-operators,,True
CFIHOS-40000733,rated peak withstand current,The rated peak withstand current for which the motor shall be rated.,Number,,CFIHOS-45000007,ECURR,,,IOGP JIP33 Alignment,,True
CFIHOS-40000734,rated short-time withstand current,The root mean square value of the current which the equipment can carry in the closed position during a specified short time.,Number,,CFIHOS-45000007,ECURR,,,IOGP JIP33 Alignment,,True
CFIHOS-40000735,rated short-time withstand current time duration,The rated short-time withstand current (Icw) time duration.,Number,,CFIHOS-45000031,TIME,,,IOGP JIP33 Alignment,,True
CFIHOS-40000736,short-circuit current in neutral conductor and in protective circuit,The low voltage switchgear and controlgear short-circuit current in neutral conductor and in protective circuit in accordance with IEC 61439-1.,Number,,CFIHOS-45000019,RATIO,,,IOGP JIP33 Alignment,,True
CFIHOS-40000737,upper limit daily average ambient air temperature,The low voltage switchgear and controlgear temperature which is the highest daily average ambient air temperature at which a functional or physical object is expected to operate.,Number,,CFIHOS-45000028,TEMP,,,IOGP JIP33 Alignment,,True
CFIHOS-40000738,upper limit relative humidity,The highest relative humidity at which a functional or physical object is designed for.,Number,,CFIHOS-45000019,RATIO,,,IOGP JIP33 Alignment,,True
CFIHOS-40000739,elevation over mean sea level,Plant elevation over mean sea level.,Number,,CFIHOS-45000011,LENGTH,,,IOGP JIP33 Alignment,,True
CFIHOS-40000740,permissible short-circuit current under arcing conditions (Ip arc),The permissible short-circuit current the equipment can withstand under arcing condition.,Number,,CFIHOS-45000007,ECURR,,,IOGP JIP33 Alignment,,True
CFIHOS-40000741,permissible arc duration,The duration of arc fault for which the assembly is rated.,Number,,CFIHOS-45000031,TIME,,,IOGP JIP33 Alignment,,True
CFIHOS-40000742,minimum vertical access bore through tree and tubing hanger,The minimum vertical access bore diameter through the x-mas tree and tubing hanger.,Number,,CFIHOS-45000011,LENGTH,,,IOGP JIP33 Alignment,,True
CFIHOS-40000743,HXT upper crown plug pressure rating,The upper crown plug pressure rating.,Number,,CFIHOS-45000017,PRESS,,,IOGP JIP33 Alignment,,True
CFIHOS-40000744,HXT lower crown plug pressure rating,The lower crown plug pressure rating.,Number,,CFIHOS-45000017,PRESS,,,IOGP JIP33 Alignment,,True
CFIHOS-40000745,VXT tubing hanger production bore plug pressure rating,The VXT TH production bore plug pressure rating.,Number,,CFIHOS-45000017,PRESS,,,IOGP JIP33 Alignment,,True
CFIHOS-40000746,VXT tubing hanger annulus bore plug pressure rating,The VXT TH annulus bore plug pressure rating.,Number,,CFIHOS-45000017,PRESS,,,IOGP JIP33 Alignment,,True
CFIHOS-40000747,VXT other tubing plug pressure rating,The VXT tubing plug or other plug pressure rating.,Number,,CFIHOS-45000017,PRESS,,,IOGP JIP33 Alignment,,True
CFIHOS-40000748,tubing hanger pup joint / saver sub outer diameter,The TH pup joint / saver sub outer diameter.,Number,,CFIHOS-45000011,LENGTH,,,IOGP JIP33 Alignment,,True
CFIHOS-40000749,tubing hanger pup joint / saver sub bore,The TH pup joint / saver sub bore.,Number,,CFIHOS-45000011,LENGTH,,,IOGP JIP33 Alignment,,True
CFIHOS-40000750,tubing hanger pup joint / saver sub length,The TH pup joint / saver sub length.,Number,,CFIHOS-45000011,LENGTH,,,IOGP JIP33 Alignment,,True
CFIHOS-40000751,flowing wellhead temperature,The flowing wellhead temperature.,Number,,CFIHOS-45000028,TEMP,,,IOGP JIP33 Alignment,,True
CFIHOS-40000752,cool down 'no touch time',The required cool down 'no touch time'.,Number,,CFIHOS-45000031,TIME,,,IOGP JIP33 Alignment,,True
CFIHOS-40000753,drift diameter,The production tubing drift diameter.,Number,,CFIHOS-45000011,LENGTH,,,IOGP JIP33 Alignment,,True
CFIHOS-40000754,number of downhole hydraulic lines,"The total number of downhole hydraulic lines required (including chemical injection, hydraulic surface-controlled subsurface safety valves (SCSSV) and hydraulic IWC lines in total).",Number,,CFIHOS-45000037,COUNT,,,IOGP JIP33 Alignment,,True
CFIHOS-40000755,number of SCSSVs,The total number of surface-controlled subsurface safety valves (SCSSV) (hydraulic and electric).,Number,,CFIHOS-45000037,COUNT,,,IOGP JIP33 Alignment,,True
CFIHOS-40000756,rated voltage for electric SCSSV,The electric power requirements of each electric surface-controlled subsurface safety valves (SCSSV) in volts.,Number,,CFIHOS-45000038,VOLTAG,,,IOGP JIP33 Alignment,,True
CFIHOS-40000757,rated current for electric SCSSV,The electric power requirements of each electric surface-controlled subsurface safety valves (SCSSV) in amps.,Number,,CFIHOS-45000007,ECURR,,,IOGP JIP33 Alignment,,True
CFIHOS-40000758,number of hydraulic lines for each hydraulic SCSSV,The number of downhole hydraulic lines required for each hydraulic surface-controlled subsurface safety valves (SCSSV).,Number,,CFIHOS-45000037,COUNT,,,IOGP JIP33 Alignment,,True
CFIHOS-40000759,flow rate capability for THAID with less than 1 in flow-by area,"The flow rate capability for THAID with less than 1 in flow-by area considering maximum required gas lift, well kill and circulation.",Number,,CFIHOS-45000034,VOLFLO,,,IOGP JIP33 Alignment,,True
CFIHOS-40000760,drift diameter of landing string,The minimum drift diameter of the landing string to allow specification of appropriately-sized HXT crown plugs or VXT TH plugs.,Number,,CFIHOS-45000011,LENGTH,,,IOGP JIP33 Alignment,,True
CFIHOS-40000761,minimum temperature for cool down 'no touch time',The minimum temperature that must be maintained during the specified 'no touch time'.,Number,,CFIHOS-45000028,TEMP,,,IOGP JIP33 Alignment,,True
CFIHOS-40000762,number of units required,Specify the number of units required.,Number,,CFIHOS-45000037,COUNT,,,IOGP JIP33 Alignment,,True
CFIHOS-40000763,average ambient operating pressure at equipment location,The average ambient pressure at the plant's location.,Number,,CFIHOS-45000017,PRESS,,,IOGP JIP33 Alignment,,True
CFIHOS-40000764,upper limit site ambient temperature,The temperature which is the highest ambient temperature at the site where the physical object is expected to operate.,Number,,CFIHOS-45000028,TEMP,,,IOGP JIP33 Alignment,,True
CFIHOS-40000765,lower limit site ambient temperature,The temperature which is the lowest ambient temperature at the site where the physical object is expected to operate.,Number,,CFIHOS-45000028,TEMP,,,IOGP JIP33 Alignment,,True
CFIHOS-40000766,lower limit site relative humidity,The humidity which is the lowest relative humidity at the site where the physical object is expected to operate.,Number,,CFIHOS-45000019,RATIO,,,IOGP JIP33 Alignment,,True
CFIHOS-40000767,lower limit operating heating steam temperature,The temperature which is the lowest heating steam temperature at which a functional or physical object is expected to operate.,Number,,CFIHOS-45000028,TEMP,,,IOGP JIP33 Alignment,,True
CFIHOS-40000768,upper limit operating heating steam temperature,The temperature which is the highest heating steam temperature at which a functional or physical object is expected to operate.,Number,,CFIHOS-45000028,TEMP,,,IOGP JIP33 Alignment,,True
CFIHOS-40000769,lower limit operating heating steam pressure,The pressure which is the lowest heating steam pressure at which a functional or physical object is expected to operate.,Number,,CFIHOS-45000017,PRESS,,,IOGP JIP33 Alignment,,True
CFIHOS-40000770,upper limit operating heating steam pressure,The pressure which is the highest heating steam pressure at which a functional or physical object is expected to operate.,Number,,CFIHOS-45000017,PRESS,,,IOGP JIP33 Alignment,,True
CFIHOS-40000771,upper limit operating cooling water inlet temperature,The temperature which is the highest cooling water inlet temperature at which a functional or physical object is expected to operate.,Number,,CFIHOS-45000028,TEMP,,,IOGP JIP33 Alignment,,True
CFIHOS-40000772,upper limit design cooling water inlet temperature,The temperature which is the highest cooling water inlet temperature at which a functional or physical object is designed for.,Number,,CFIHOS-45000028,TEMP,,,IOGP JIP33 Alignment,,True
CFIHOS-40000773,upper limit design cooling water inlet pressure,The pressure which is the highest cooling water inlet pressure at which a functional or physical object is designed for.,Number,,CFIHOS-45000017,PRESS,,,IOGP JIP33 Alignment,,True
CFIHOS-40000774,upper limit design cooling water pressure,The pressure which is the highest cooling water pressure at which a functional or physical object is designed for.,Number,,CFIHOS-45000017,PRESS,,,IOGP JIP33 Alignment,,True
CFIHOS-40000775,lower limit operating instrument air pressure,The pressure which is the lowest instrument air pressure at which a functional or physical object is expected to operate.,Number,,CFIHOS-45000017,PRESS,,,IOGP JIP33 Alignment,,True
CFIHOS-40000776,lower upper operating instrument air pressure,The pressure which is the highest instrument air pressure at which a functional or physical object is expected to operate.,Number,,CFIHOS-45000017,PRESS,,,IOGP JIP33 Alignment,,True
CFIHOS-40000777,vapour pressure at rated temperature,The vapour pressure rated temperature to which an installed item is rated.,Number,,CFIHOS-45000017,PRESS,,,IOGP JIP33 Alignment,,True
CFIHOS-40000778,upper limit vapour pressure,A vapour pressure which is the highest vapour pressure at which a functional or physical object is expected to operate.,Number,,CFIHOS-45000017,PRESS,,,IOGP JIP33 Alignment,,True
CFIHOS-40000779,lower limit vapour pressure,A vapour pressure which is the lowest vapour pressure at which a functional or physical object is expected to operate.,Number,,CFIHOS-45000017,PRESS,,,IOGP JIP33 Alignment,,True
CFIHOS-40000780,rated relative density,The rated ratio of the density (mass of a unit volume) of a substance to the density of a given reference material.,Number,,CFIHOS-45000002,DENSI,,,IOGP JIP33 Alignment,,True
CFIHOS-40000781,upper limit liquid density,A liquid density which is the highest density at which a functional or physical object is expected to operate.,Number,,CFIHOS-45000002,DENSI,,,IOGP JIP33 Alignment,,True
CFIHOS-40000782,lower limit liquid density,A liquid density which is the lowest density at which a functional or physical object is expected to operate.,Number,,CFIHOS-45000002,DENSI,,,IOGP JIP33 Alignment,,True
CFIHOS-40000783,normal specific heat ratio Cp/Cv,The specific heat ratio which is the normal specific heat for the process medium.,Number,,CFIHOS-45000019,RATIO,,,IOGP JIP33 Alignment,,True
CFIHOS-40000784,upper limit specific heat ratio Cp/Cv,The specific heat ratio which is the highest specific heat for the process medium.,Number,,CFIHOS-45000019,RATIO,,,IOGP JIP33 Alignment,,True
CFIHOS-40000785,lower limit specific heat ratio Cp/Cv,The specific heat ratio which is the lowest specific heat for the process medium.,Number,,CFIHOS-45000019,RATIO,,,IOGP JIP33 Alignment,,True
CFIHOS-40000786,upper limit operating liquid dynamic viscosity,The highest dynamic viscosity of the fluid in liquid phase at which a functional or physical object is expected to operate normally.,Number,,CFIHOS-45000004,VISDYN,,,IOGP JIP33 Alignment,,True
CFIHOS-40000787,lower limit operating liquid dynamic viscosity,The lowest dynamic viscosity of the fluid in liquid phase at which a functional or physical object is expected to operate normally.,Number,,CFIHOS-45000004,VISDYN,,,IOGP JIP33 Alignment,,True
CFIHOS-40000788,total dissolved salts,The amount of dissolved salts.,Number,,CFIHOS-45000015,MPROPO,,,IOGP JIP33 Alignment,,True
CFIHOS-40000789,particle size,Average solid particle size in fluid.,Number,,CFIHOS-45000011,LENGTH,,,IOGP JIP33 Alignment,,True
CFIHOS-40000790,particle concentration,Average solid particle concentration in fluid.,Number,,CFIHOS-45000015,MPROPO,,,IOGP JIP33 Alignment,,True
CFIHOS-40000791,alternate operating volume flow rate,A volume flow rate that is the alternate conditions volume flow rate at which a functional or physical object is expected to operate.,Number,,CFIHOS-45000034,VOLFLO,,,IOGP JIP33 Alignment,,True
CFIHOS-40000792,rated flow net positive suction head available,NPSHA that is available for a particular pumping system at rated flow condition.,Number,,CFIHOS-45000011,LENGTH,,,IOGP JIP33 Alignment,,True
CFIHOS-40000793,normal flow net positive suction head available,NPSHA that is available for a particular pumping system at normal flow condition.,Number,,CFIHOS-45000011,LENGTH,,,IOGP JIP33 Alignment,,True
CFIHOS-40000794,upper limit flow net positive suction head available,NPSHA that is available for a particular pumping system at highest flow condition.,Number,,CFIHOS-45000011,LENGTH,,,IOGP JIP33 Alignment,,True
CFIHOS-40000795,lower limit flow net positive suction head available,NPSHA that is available for a particular pumping system at lowest flow condition.,Number,,CFIHOS-45000011,LENGTH,,,IOGP JIP33 Alignment,,True
CFIHOS-40000796,alternate flow positive suction head available,NPSHA that is available for a particular pumping system at alternate flow condition.,Number,,CFIHOS-45000011,LENGTH,,,IOGP JIP33 Alignment,,True
CFIHOS-40000797,NPSHA available at 120% of rated flow,NPSHA that is available for a particular pumping system at 120% of rated flow condition.,Number,,CFIHOS-45000011,LENGTH,,,IOGP JIP33 Alignment,,True
CFIHOS-40000798,rated operating temperature,The rated temperature at which a functional or physical object is expected to operate.,Number,,CFIHOS-45000028,TEMP,,,IOGP JIP33 Alignment,,True
CFIHOS-40000799,alternate operating temperature,The temperature at an alternate case at which a functional or physical object is expected to operate.,Number,,CFIHOS-45000028,TEMP,,,IOGP JIP33 Alignment,,True
CFIHOS-40000800,rated discharge pressure,The discharge pressure to which an installed item is rated.,Number,,CFIHOS-45000017,PRESS,,,IOGP JIP33 Alignment,,True
CFIHOS-40000801,alternative operating pressure,The rated pressure at which a functional or physical object is expected to operate in alternate conditions.,Number,,CFIHOS-45000017,PRESS,,,IOGP JIP33 Alignment,,True
CFIHOS-40000802,rated operating suction pressure,The rated suction pressure at which a functional or physical object is expected to operate.,Number,,CFIHOS-45000017,PRESS,,,IOGP JIP33 Alignment,,True
CFIHOS-40000803,normal operating suction pressure,The normal suction pressure at which a functional or physical object is expected to operate.,Number,,CFIHOS-45000017,PRESS,,,IOGP JIP33 Alignment,,True
CFIHOS-40000804,rated operating differential pressure,The rated differential pressure at which a functional or physical object is expected to operate.,Number,,CFIHOS-45000017,PRESS,,,IOGP JIP33 Alignment,,True
CFIHOS-40000805,alternative design differential pressure,The differential pressure at which a functional or physical object is designed for in alternate conditions.,Number,,CFIHOS-45000017,PRESS,,,IOGP JIP33 Alignment,,True
CFIHOS-40000806,rated operating differential head pressure,The differential pressure at which a functional or physical object is expected to operate normally.,Number,,CFIHOS-45000017,PRESS,,,IOGP JIP33 Alignment,,True
CFIHOS-40000807,alternative operating differential head pressure,The rated differential pressure head at which a functional or physical object is expected to operate in alternate conditions.,Number,,CFIHOS-45000017,PRESS,,,IOGP JIP33 Alignment,,True
CFIHOS-40000808,rated hydraulic power,The rated power that the pumping action takes.,Number,,CFIHOS-45000016,POWER,,,IOGP JIP33 Alignment,,True
CFIHOS-40000809,upper limit diameter,The upper limit intercept made by the circumference on a straight line through the centre of a circle.,Number,,CFIHOS-45000011,LENGTH,,,IOGP JIP33 Alignment,,True
CFIHOS-40000810,lower limit diameter,The designed intercept made by the circumference on a straight line through the centre of a circle.,Number,,CFIHOS-45000011,LENGTH,,,IOGP JIP33 Alignment,,True
CFIHOS-40000811,proposal curve best efficiency point flow (at rated impeller diameter),Flow at Best Efficiency Point (BEP) of the proposed curve at rated impeller diameter.,Number,,CFIHOS-45000034,VOLFLO,,,IOGP JIP33 Alignment,,True
CFIHOS-40000812,lower limit thermal mass flow,Minimum mass flow measured by a thermal mass flow element.,Number,,CFIHOS-45000034,VOLFLO,,,IOGP JIP33 Alignment,,True
CFIHOS-40000813,lower limit stable flow,Minimum flow that can be sustained stably.,Number,,CFIHOS-45000034,VOLFLO,,,IOGP JIP33 Alignment,,True
CFIHOS-40000814,start of operating flow region,The beginning of the range of flow in operating conditions.,Number,,CFIHOS-45000034,VOLFLO,,,IOGP JIP33 Alignment,,True
CFIHOS-40000815,end of operating flow region,The end of the range of flow in operating conditions.,Number,,CFIHOS-45000034,VOLFLO,,,IOGP JIP33 Alignment,,True
CFIHOS-40000816,start of allowable operating flow region,The beginning of the range of allowable flow in operating conditions.,Number,,CFIHOS-45000034,VOLFLO,,,IOGP JIP33 Alignment,,True
CFIHOS-40000817,end of allowable operating flow region,The end of the range of allowable flow in operating conditions.,Number,,CFIHOS-45000034,VOLFLO,,,IOGP JIP33 Alignment,,True
CFIHOS-40000818,upper limit head at rated impeller,The head that is the highest that can be obtained for the rated impeller.,Number,,CFIHOS-45000011,LENGTH,,,IOGP JIP33 Alignment,,True
CFIHOS-40000819,upper limit power at rated impeller,The power that is the highest allowed for the rated impeller.,Number,,CFIHOS-45000016,POWER,,,IOGP JIP33 Alignment,,True
CFIHOS-40000820,NPSH3 at rated flow,The net positive suction head available to a pump under test at a the rated flow when the pump head is decreased by 3 percent as a result of cavitation caused by a decreasing available suction head.,Number,,CFIHOS-45000011,LENGTH,,,IOGP JIP33 Alignment,,True
CFIHOS-40000821,NPSH3 at 120 % of flow,The net positive suction head available to a pump under test at a 120% of the rated flow when the pump head is decreased by 3 percent as a result of cavitation caused by a decreasing available suction head.,Number,,CFIHOS-45000011,LENGTH,,,IOGP JIP33 Alignment,,True
CFIHOS-40000822,NPSHa-NPSH3 margin at rated flow,The net positive suction head available at rated flow minus the NPSH3; the net positive suction head available to a pump under test at a the rated flow when the pump head is decreased by 3 percent as a result of cavitation caused by a decreasing available suction head.,Number,,CFIHOS-45000011,LENGTH,,,IOGP JIP33 Alignment,,True
CFIHOS-40000823,NPSHa-NPSH3 margin in allowable operating region,The net positive suction head in the operating range of flow minus the NPSH3; the net positive suction head available to a pump under test at a the operating range of flow when the pump head is decreased by 3 percent as a result of cavitation caused by a decreasing available suction head.,Number,,CFIHOS-45000011,LENGTH,,,IOGP JIP33 Alignment,,True
CFIHOS-40000824,specific pump suction-specific speed,The rotational speed which is the suction-specific rotational speed for the pump.,Number,,CFIHOS-45000036,ANGVEL,,,IOGP JIP33 Alignment,,True
CFIHOS-40000825,upper limit allowable sound pressure level,"The highest allowable acoustic wave strength, which is the local pressure deviation from the ambient (average or equilibrium) atmospheric pressure, caused by a sound wave.",Number,,CFIHOS-45000021,SOUND,,,IOGP JIP33 Alignment,,True
CFIHOS-40000826,upper limit sound power level,The highest sound pressure level at which a functional or physical object is designed.,Number,,CFIHOS-45000021,SOUND,,,IOGP JIP33 Alignment,,True
CFIHOS-40000827,number of vanes,The number of vanes.,Number,,CFIHOS-45000037,COUNT,,,IOGP JIP33 Alignment,,True
CFIHOS-40000828,drain nominal size,The nominal size of the drain.,Number,,CFIHOS-45000011,LENGTH,,,IOGP JIP33 Alignment,,True
CFIHOS-40000829,pressure casing vent size,The nominal size of the casing vent.,Number,,CFIHOS-45000011,LENGTH,,,IOGP JIP33 Alignment,,True
CFIHOS-40000830,pump discharge head maximum allowable working pressure,The pump discharge head MAWP.,Number,,CFIHOS-45000017,PRESS,,,IOGP JIP33 Alignment,,True
CFIHOS-40000831,pump column maximum allowable working pressure,The pump column MAWP.,Number,,CFIHOS-45000017,PRESS,,,IOGP JIP33 Alignment,,True
CFIHOS-40000832,pump bowl maximum allowable working pressure,The pump bowl MAWP.,Number,,CFIHOS-45000017,PRESS,,,IOGP JIP33 Alignment,,True
CFIHOS-40000833,pump suction barrel or can maximum allowable working pressure,The pump suction barrel or can MAWP.,Number,,CFIHOS-45000017,PRESS,,,IOGP JIP33 Alignment,,True
CFIHOS-40000834,line shaft bearing quantity,Specify the quantity of line shaft bearings required.,Number,,CFIHOS-45000037,COUNT,,,IOGP JIP33 Alignment,,True
CFIHOS-40000835,low liquid level elevation,Specify the process liquid low level elevation.,Number,,CFIHOS-45000011,LENGTH,,,IOGP JIP33 Alignment,,True
CFIHOS-40000836,sump floor elevation,Specify the sump floor elevation.,Number,,CFIHOS-45000011,LENGTH,,,IOGP JIP33 Alignment,,True
CFIHOS-40000837,sump diameter,Specify the diameter of the sump in which the proposed pump will be installed.,Number,,CFIHOS-45000011,LENGTH,,,IOGP JIP33 Alignment,,True
CFIHOS-40000838,grade to top of pump discharge connection dimension,Specify the grade to top of proposed pump discharge connection dimension.,Number,,CFIHOS-45000011,LENGTH,,,IOGP JIP33 Alignment,,True
CFIHOS-40000839,pump length (grade to underside of pump inlet bell or strainer dimension),Specify the proposed pump length (grade to underside of pump inlet bell or strainer dimension) below grade.,Number,,CFIHOS-45000011,LENGTH,,,IOGP JIP33 Alignment,,True
CFIHOS-40000840,grade to first stage impeller centerline dimension,Specify the grade to the proposed pump first stage impeller centerline dimension.,Number,,CFIHOS-45000011,LENGTH,,,IOGP JIP33 Alignment,,True
CFIHOS-40000841,grade to liquid minimum submergence level dimension,Specify the grade to pump process liquid minimum submergence level dimension.,Number,,CFIHOS-45000011,LENGTH,,,IOGP JIP33 Alignment,,True
CFIHOS-40000842,upper limit static sealing pressure,The highest static sealing pressure at which a functional or physical object is expected to operate normally.,Number,,CFIHOS-45000017,PRESS,,,IOGP JIP33 Alignment,,True
CFIHOS-40000843,lower limit static sealing pressure,The lowest dynamic viscosity of the fluid in liquid phase at which a functional or physical object is expected to operate normally.,Number,,CFIHOS-45000017,PRESS,,,IOGP JIP33 Alignment,,True
CFIHOS-40000844,upper limit dynamic sealing pressure,The highest dynamic sealing pressure at which a functional or physical object is expected to operate normally.,Number,,CFIHOS-45000017,PRESS,,,IOGP JIP33 Alignment,,True
CFIHOS-40000845,lower limit dynamic sealing pressure,The lowest dynamic viscosity of the fluid in liquid phase at which a functional or physical object is expected to operate normally.,Number,,CFIHOS-45000017,PRESS,,,IOGP JIP33 Alignment,,True
CFIHOS-40000846,upper limit seal design temperature,The highest seal design temperature at which a functional or physical object is expected to operate normally.,Number,,CFIHOS-45000028,TEMP,,,IOGP JIP33 Alignment,,True
CFIHOS-40000847,lower limit seal design temperature,The lowest dynamic viscosity of the fluid in liquid phase at which a functional or physical object is expected to operate normally.,Number,,CFIHOS-45000028,TEMP,,,IOGP JIP33 Alignment,,True
CFIHOS-40000848,driver nameplate power,Specify the driver nameplate power.,Number,,CFIHOS-45000016,POWER,,,IOGP JIP33 Alignment,,True
