Source standard document and data requirement CFIHOS unique code,tag class CFIHOS unique code,tag class name,source standard CFIHOS unique code,source standard code,source standard document and data requirement number,source standard document and data requirement title,source standard document and data requirement typical deliverable,source standard document and data requirement description,source standard document and data requirement comment,document and data requirement type code,document and data requirement group code,engineering standard source chapter,discipline CFIHOS unique code,discipline name,document type CFIHOS unique code,document type name,default submit at proposal indicator,default submit for review indicator,default submit at delivery indicator,default issue for review number of weeks,default issue for review reference date,default issue for approval number of weeks,default issue for approval reference date,default for information number of weeks,default for information reference date,default required handover status code,default required translation indicator,deliverable format code
CFIHOS-68000101,CFIHOS-30000370,switchgear and controlgear,CFIHOS-90000053,IOGP S-560:2016,S560-IR-102,NAME PLATE FORMAT DRAWING,name plate drawing,,,equipment,technical information deliverables,"S-560, Clause 6.1",,,CFIHOS-70000445,name plate diagram,,no,no,,,,,,,AFD,yes,
CFIHOS-68000102,CFIHOS-30000370,switchgear and controlgear,CFIHOS-90000053,IOGP S-560:2016,S560-IR-103,PSC ASSEMBLY FUNCTIONAL UNIT SUB-ASSEMBLY ARRANGEMENT,assembly diagram,NOTE - To provide individual compartment arrangements if required by the User,,equipment,technical information deliverables,"S-560, Clauses 8.5.2.101 / 8.5.3.101",,,CFIHOS-70000017,assembly diagram,,no,no,,,,,,,AFD,yes,
CFIHOS-68000103,CFIHOS-30000370,switchgear and controlgear,CFIHOS-90000053,IOGP S-560:2016,S560-IR-105,PSC-ASSEMBLY INTERNAL INTERCONNECTION DIAGRAM,connection diagram,,,equipment,technical information deliverables,,,,CFIHOS-70000055,connection diagram,,no,no,,,,,,,AFD,yes,
CFIHOS-68000104,CFIHOS-30000370,switchgear and controlgear,CFIHOS-90000053,IOGP S-560:2016,S560-IR-106,PSC-ASSEMBLY EXTERNAL TERMINATION DIAGRAM,termination diagram,,,equipment,technical information deliverables,,,,CFIHOS-70000330,termination diagram,,no,no,,,,,,,AFD,yes,
CFIHOS-68000105,CFIHOS-30000370,switchgear and controlgear,CFIHOS-90000053,IOGP S-560:2016,S560-IR-108,ELECTRICAL PROTECTION STUDY,safe operation study,,,equipment,technical information deliverables,"S-560, Clause 8.6.2.3 / IEC61349-1 Clause 9.3.4",,,CFIHOS-70000322,safe operation study,,no,no,,,,,,,AFD,yes,
CFIHOS-68000106,CFIHOS-30000370,switchgear and controlgear,CFIHOS-90000053,IOGP S-560:2016,S560-IR-109,CURRENT AND POTENTIAL (CT/VT) TRANSFORMER CURVES,curves and tables calculations,,,equipment,technical information deliverables,"S-560 Clauses 8.5.3.109, 8.5.3.110",,,CFIHOS-70000449,performance report,,no,no,,,,,,,AFD,yes,
CFIHOS-68000107,CFIHOS-30000370,switchgear and controlgear,CFIHOS-90000053,IOGP S-560:2016,S560-IR-110,PERFORMANCE DATA,manufacturer datasheet,"NOTE - Electrical characterisitics of protection devices and switching devices included within the PSC-Assembly for the User power systems studies eg short circuit, arc flash and protection relay coordination etc.",,equipment,technical information deliverables,"S-560, Clause 9",,,CFIHOS-70000416,manufacturer datasheet,,no,no,,,,,,,AFD,yes,
CFIHOS-68000108,CFIHOS-30000370,switchgear and controlgear,CFIHOS-90000053,IOGP S-560:2016,S560-IR-112,PACKING / UNPACKING AND PRESERVATION PROCEDURE,"handling, shipping and storage procedure",NOTE - Intial submission to be provided for project execution planning and then to be included in the final manuals,,equipment,technical information deliverables,,,,CFIHOS-70000154,"handling, shipping, storage procedure",,no,no,,,,,,,AFD,yes,
CFIHOS-68000109,CFIHOS-30000370,switchgear and controlgear,CFIHOS-90000053,IOGP S-560:2016,S560-IR-113,"LOGISTICS, HANDLING AND SHIPPING PROCEDURE & ASSOCIATED DRAWINGS","handling, shipping and storage procedure",NOTE - Intial submission to be provided for project execution planning and then to be included in the final manuals.,,equipment,technical information deliverables,,,,CFIHOS-70000154,"handling, shipping, storage procedure",,no,no,,,,,,,AFD,yes,
CFIHOS-68000110,CFIHOS-30000370,switchgear and controlgear,CFIHOS-90000053,IOGP S-560:2016,S560-IR-115,QUALITY MANAGEMENT SYSTEM AND CERTIFICATION,flawless project delivery quality plan,,,equipment,technical information deliverables,,,,CFIHOS-70000451,quality plan,,no,no,,,,,,,AFD,yes,
CFIHOS-68000111,CFIHOS-30000370,switchgear and controlgear,CFIHOS-90000053,IOGP S-560:2016,S560-IR-116,QUALITY PLAN,quality plan,,,equipment,technical information deliverables,,,,CFIHOS-70000451,quality plan,,no,no,,,,,,,AFD,yes,
CFIHOS-68000112,CFIHOS-30000370,switchgear and controlgear,CFIHOS-90000053,IOGP S-560:2016,S560-IR-117,INSPECTION AND TEST PLAN (ITP),inspection and test plan,,,equipment,technical information deliverables,,,,CFIHOS-70000180,inspection and test plan,,no,no,,,,,,,AFD,yes,
CFIHOS-68000113,CFIHOS-30000370,switchgear and controlgear,CFIHOS-90000053,IOGP S-560:2016,S560-IR-118,ROUTINE VERIFICATION AND PERFORMANCE TEST PROCEDURE,test procedure,,,equipment,technical information deliverables,"S-560, Clauses 10, 11",,,CFIHOS-70000332,test procedure,,no,no,,,,,,,AFD,yes,
CFIHOS-68000114,CFIHOS-30000370,switchgear and controlgear,CFIHOS-90000053,IOGP S-560:2016,S560-IR-119,ECMS SIMULATION TEST PROCEDURE,test procedure,,,equipment,technical information deliverables,"S-560, Clause 11.101",,,CFIHOS-70000332,test procedure,,no,no,,,,,,,AFD,yes,
CFIHOS-68000115,CFIHOS-30000370,switchgear and controlgear,CFIHOS-90000053,IOGP S-560:2016,S560-IR-120,SITE ACCEPTANCE TEST PROCEDURE,site acceptance test procedure,,,equipment,technical information deliverables,,,,CFIHOS-70000428,site acceptance test procedure,,no,no,,,,,,,AFD,yes,
CFIHOS-68000116,CFIHOS-30000370,switchgear and controlgear,CFIHOS-90000053,IOGP S-560:2016,S560-IR-122,SPECIAL TOOLS LIST,special tools list,,,equipment,technical information deliverables,,,,CFIHOS-70000454,special tools list,,no,no,,,,,,,AFD,yes,
CFIHOS-68000117,CFIHOS-30000370,switchgear and controlgear,CFIHOS-90000053,IOGP S-560:2016,S560-IR-123,SPARE PARTS RECOMMENDATIONS,spare part list,,,equipment,technical information deliverables,,,,CFIHOS-70000374,spare part list,,no,no,,,,,,,AFD,yes,
CFIHOS-68000118,CFIHOS-30000370,switchgear and controlgear,CFIHOS-90000053,IOGP S-560:2016,S560-IR-125,TYPE TEST / APPROVAL CERTIFICATES,type test report,,,equipment,technical information deliverables,,,,CFIHOS-70000245,inspection report,,no,no,,,,,,,AFD,yes,
CFIHOS-68000119,CFIHOS-30000370,switchgear and controlgear,CFIHOS-90000053,IOGP S-560:2016,S560-IR-127,ROUTINE VERIFICATION TEST REPORT,type test report,NOTE - FAT reports from factory acceptance tests.,,equipment,technical information deliverables,,,,CFIHOS-70000245,inspection report,,no,no,,,,,,,AFD,yes,
CFIHOS-68000120,CFIHOS-30000370,switchgear and controlgear,CFIHOS-90000053,IOGP S-560:2016,S560-IR-128,ECMS SIMULATION TEST REPORT,type test report,,,equipment,technical information deliverables,,,,CFIHOS-70000245,inspection report,,no,no,,,,,,,AFD,yes,
CFIHOS-68000121,CFIHOS-30000370,switchgear and controlgear,CFIHOS-90000053,IOGP S-560:2016,S560-IR-129,ROUTINE VERIFICATION (SITE ACCEPTANCE) TEST REPORT,type test report,,,equipment,technical information deliverables,,,,CFIHOS-70000245,inspection report,,no,no,,,,,,,AFD,yes,
CFIHOS-68000122,CFIHOS-30000370,switchgear and controlgear,CFIHOS-90000053,IOGP S-560:2016,S560-IR-131,INSTRUMENT TEST AND CALIBRATION CERTIFICATE,calibration certificate,NOTE - Manufacturers record of equipment used during routine verification.,,equipment,technical information deliverables,,,,CFIHOS-70000415,calibration certificate,,no,no,,,,,,,AFD,yes,
CFIHOS-68000123,CFIHOS-30000370,switchgear and controlgear,CFIHOS-90000053,IOGP S-560:2016,S560-IR-132,LIFTING EQUIPMENT TEST CERTIFICATE,lifting equipment test certificate,NOTE - Withdrawable functional unit handling equipment.,,equipment,technical information deliverables,,,,CFIHOS-70000432,lifting certificate,,no,no,,,,,,,AFD,yes,
CFIHOS-68000124,CFIHOS-30000370,switchgear and controlgear,CFIHOS-90000053,IOGP S-560:2016,S560-IR-133,CERTIFICATE OF CONFORMITY,approval certificate,,,equipment,technical information deliverables,"S-560, Clause 1",,,CFIHOS-70000013,approval certificate,,no,no,,,,,,,AFD,yes,
CFIHOS-68000125,CFIHOS-30000370,switchgear and controlgear,CFIHOS-90000053,IOGP S-560:2016,S560-IR-135,CONCESSION REQUESTS,concession requests,"NOTE - Deviations and concession requests which are identified from the requisition package, post placement of the purchase order and require approval by the User. Based on the User's system for Concession Requests.",,equipment,technical information deliverables,,,,CFIHOS-70000389,technical deviation request,,no,no,,,,,,,AFD,yes,
CFIHOS-68000126,CFIHOS-30000370,switchgear and controlgear,CFIHOS-90000053,IOGP S-560:2016,S560-IR-137,DESPATCH DOSSIER,index of documents,"NOTE - All necessary documents are provided for shipments and customs. Shall also include items such as the FAT report, punchlist items, items to be shipped loose, transport requirements and presevations requirements etc. User will agree contents list and",,equipment,technical information deliverables,,,,CFIHOS-70000178,index of documents,,no,no,,,,,,,AFD,yes,
CFIHOS-68000127,CFIHOS-30000370,switchgear and controlgear,CFIHOS-90000053,IOGP S-560:2016,S560-IR-138,MANUFACTURING RECORD BOOK,manufacturer record book (mrb),"NOTE - Record book is a historical record of all sub-components within the PSC-Assembly, associated documentation and routine verification, held by Manufacturer for review by the User during manufacture of the PSC-Assembly. This may contain additional doc",,equipment,technical information deliverables,,,,CFIHOS-70000178,index of documents,,no,no,,,,,,,AFD,yes,
CFIHOS-68000128,CFIHOS-30000370,switchgear and controlgear,CFIHOS-90000053,IOGP S-560:2016,S560-IR-139,"INSTRUCTION FOR HANDLING, INSTALLATION, OPERATION AND MAINTENANCE","installation manual, operating manual, maintenance manual",NOTE - Initial submission to be index for manuals followed by complete submission following FAT.,,equipment,technical information deliverables,"IEC61349-1, Clause 6.2.2",,,CFIHOS-70000228,operating manual,,no,no,,,,,,,AFD,yes,
CFIHOS-68000129,CFIHOS-30000370,switchgear and controlgear,CFIHOS-90000053,IOGP S-560:2016,S560-IR-141,"HSE MANAGEMENT SYSTEM (PLANS, POLICY, COMPLIANCE)",,NOTE - HSE plans covers the manufacturing and potentially the installation phase. It covers both User and Manufacturer's representatives in relation to the PSC-Assembly.,,equipment,technical information deliverables,,,,CFIHOS-70000088,design hse case,,no,no,,,,,,,AFD,yes,
CFIHOS-68000130,CFIHOS-30000370,switchgear and controlgear,CFIHOS-90000053,IOGP S-560:2016,S560-IR-143,MANUFACTURER TAG REGISTER (if applicable),master tag-equipment register,NOTE - Schedule of data for all identified items within the PSC-Assembly. The formal structure of this will be agreed between User and Manufacturer.Requirements should be detailed in the requisition package.,,equipment,technical information deliverables,,,,CFIHOS-70000122,master tag-equipment register,,no,no,,,,,,,AFD,yes,
CFIHOS-68000131,CFIHOS-30000370,switchgear and controlgear,CFIHOS-90000053,IOGP S-560:2016,S560-IR-84,SUPPLIER DELIVERABLES REGISTER (SDR),master document register,,,equipment,contract management information deliverables,,,,CFIHOS-70000099,master document register,,no,no,,,,,,,AFD,yes,
CFIHOS-68000132,CFIHOS-30000370,switchgear and controlgear,CFIHOS-90000053,IOGP S-560:2016,S560-IR-85,FABRICATION PRODUCTION SCHEDULE,fabrication schedule,,,equipment,contract management information deliverables,,,,CFIHOS-70000132,fabrication schedule,,no,no,,,,,,,AFD,yes,
CFIHOS-68000133,CFIHOS-30000370,switchgear and controlgear,CFIHOS-90000053,IOGP S-560:2016,S560-IR-86,PROGRESS REPORT,progress report,,,equipment,contract management information deliverables,,,,CFIHOS-70000300,progress report,,no,no,,,,,,,AFD,yes,
CFIHOS-68000134,CFIHOS-30000370,switchgear and controlgear,CFIHOS-90000053,IOGP S-560:2016,S560-IR-87,BOUGHT OUT ITEMS LIST,bill of materials,NOTE - Covers Bill of Materials and can be provided as part of the Schematic Wiring Diagrams (3.2),,equipment,contract management information deliverables,,,,CFIHOS-70000028,bill of materials,,no,no,,,,,,,AFD,yes,
CFIHOS-68000135,CFIHOS-30000370,switchgear and controlgear,CFIHOS-90000053,IOGP S-560:2016,S560-IR-89,PSC ASSEMBLY GENERAL ARRANGEMENT DRAWING,general arrangement diagram,,,equipment,technical information deliverables,,,,CFIHOS-70000153,general arrangement diagram,,no,no,,,,,,,AFD,yes,
CFIHOS-68000136,CFIHOS-30000370,switchgear and controlgear,CFIHOS-90000053,IOGP S-560:2016,S560-IR-90,INTERFACE AND CONNECTION SCHEDULE,connection diagram,"NOTE - Covers items such as network architecture, field interconnection diagrams etc",,equipment,technical information deliverables,"S-560, Clauses 3.10.4, 8.6.2.2",,,CFIHOS-70000055,connection diagram,,no,no,,,,,,,AFD,yes,
CFIHOS-68000137,CFIHOS-30000370,switchgear and controlgear,CFIHOS-90000053,IOGP S-560:2016,S560-IR-92,SINGLE LINE ELECTRICAL DIAGRAM,single line diagram,,,equipment,technical information deliverables,,,,CFIHOS-70000371,single line diagram,,no,no,,,,,,,AFD,yes,
CFIHOS-68000138,CFIHOS-30000370,switchgear and controlgear,CFIHOS-90000053,IOGP S-560:2016,S560-IR-93,FUNCTIONAL UNIT SCHEMATIC DIAGRAM,schematic diagram,,,equipment,technical information deliverables,,,,CFIHOS-70000328,schematic diagram,,no,no,,,,,,,AFD,yes,
CFIHOS-68000139,CFIHOS-30000370,switchgear and controlgear,CFIHOS-90000053,IOGP S-560:2016,S560-IR-94,UTILITIES SCHEDULE (Absorbed AC / DC power),utility consumption report,,,equipment,technical information deliverables,,,,CFIHOS-70000259,general report,,no,no,,,,,,,AFD,yes,
CFIHOS-68000140,CFIHOS-30000370,switchgear and controlgear,CFIHOS-90000053,IOGP S-560:2016,S560-IR-95,WEIGHT DATA SHEET,weight calculation,,,equipment,technical information deliverables,"S-560, Clause 7.3",,,CFIHOS-70000357,weight calculation,,no,no,,,,,,,AFD,yes,
CFIHOS-68000141,CFIHOS-30000370,switchgear and controlgear,CFIHOS-90000053,IOGP S-560:2016,S560-IR-96,EQUIPMENT DATA SHEET,manufacturer datasheet,,,equipment,technical information deliverables,"S-560, Clause 5",,,CFIHOS-70000416,manufacturer datasheet,,no,no,,,,,,,AFD,yes,
CFIHOS-68000142,CFIHOS-30000370,switchgear and controlgear,CFIHOS-90000053,IOGP S-560:2016,S560-IR-97,DETAILED DESCRIPTION OF OPERATION,functional design specification,NOTE - Details functional interlocking arrangement for PSC-Assembly where required.,,equipment,technical information deliverables,,,,CFIHOS-70000244,functional design specification,,no,no,,,,,,,AFD,yes,
CFIHOS-68000143,CFIHOS-30000370,switchgear and controlgear,CFIHOS-90000053,IOGP S-560:2016,S560-IR-98,HEAT DISSIPATION DATA,heat dissipation calculation & loads,,,equipment,technical information deliverables,"IEC 61439-1, Clause 10.10.4",,,CFIHOS-70000441,heat dissipation calculation,,no,no,,,,,,,AFD,yes,
CFIHOS-68000144,CFIHOS-30000370,switchgear and controlgear,CFIHOS-90000053,IOGP S-560:2016,S560-IR-99,FUNCTIONAL LOGIC DIAGRAM,logic diagram,,,equipment,technical information deliverables,"S-560, Clauses 3.10.11, 8.6.2.3",,,CFIHOS-70000248,logic diagram,,no,no,,,,,,,AFD,yes,
CFIHOS-68000145,CFIHOS-30000806,ball control valve,CFIHOS-90000055,IOGP S-562:2019,API 6D #01,Design verification and validation report,third party design verification report,Design verification and validation report by certification body/agency,,equipment,technical information deliverables,"API 6D, Annex N(i)",,,CFIHOS-70000092,design review report,no,yes,yes,,,,,,WAO,AFD,no,
CFIHOS-68000145,CFIHOS-30000807,ball valve,CFIHOS-90000055,IOGP S-562:2019,API 6D #01,Design verification and validation report,third party design verification report,Design verification and validation report by certification body/agency,,equipment,technical information deliverables,"API 6D, Annex N(i)",,,CFIHOS-70000092,design review report,no,yes,yes,,,,,,WAO,AFD,no,
CFIHOS-68000146,CFIHOS-30000806,ball control valve,CFIHOS-90000055,IOGP S-562:2019,API 6D #02,Non-destructive examination procedures,non-destructive examination procedures,"Define method, extent and acceptance levels of all NDE used to verify that materials and / or formed or welded fabrications comply with the Buyer's requirements. To include as applicable visual, radiographic, ultrasonic, magnetic particle, dye penetrant,",,equipment,technical information deliverables,"API 6D, Annex N(s)",,,CFIHOS-70000227,non destructive test procedure,no,yes,yes,,,,,,WAO,AFD,no,
CFIHOS-68000146,CFIHOS-30000807,ball valve,CFIHOS-90000055,IOGP S-562:2019,API 6D #02,Non-destructive examination procedures,non-destructive examination procedures,"Define method, extent and acceptance levels of all NDE used to verify that materials and / or formed or welded fabrications comply with the Buyer's requirements. To include as applicable visual, radiographic, ultrasonic, magnetic particle, dye penetrant,",,equipment,technical information deliverables,"API 6D, Annex N(s)",,,CFIHOS-70000227,non destructive test procedure,no,yes,yes,,,,,,WAO,AFD,no,
CFIHOS-68000147,CFIHOS-30000806,ball control valve,CFIHOS-90000055,IOGP S-562:2019,API 6D #03,Weld procedure specification,weld procdure specification,"All Weld Procedure Specification (WPS) documents are required to be issued in a single submission, together with the respective Weld Procedure Qualification Records (WPQR) and a listing register to show status of approval qualification records.",,equipment,technical information deliverables,"API 6D, Annex N(x)",,,CFIHOS-70000408,welding procedure specification,no,yes,yes,,,,,,WAO,AFD,no,
CFIHOS-68000147,CFIHOS-30000807,ball valve,CFIHOS-90000055,IOGP S-562:2019,API 6D #03,Weld procedure specification,weld procdure specification,"All Weld Procedure Specification (WPS) documents are required to be issued in a single submission, together with the respective Weld Procedure Qualification Records (WPQR) and a listing register to show status of approval qualification records.",,equipment,technical information deliverables,"API 6D, Annex N(x)",,,CFIHOS-70000408,welding procedure specification,no,yes,yes,,,,,,WAO,AFD,no,
CFIHOS-68000148,CFIHOS-30000806,ball control valve,CFIHOS-90000055,IOGP S-562:2019,API 6D #04,Weld procedure qualification records,weld procedure qualification records,Define all shop and field welding (including cladding / weld overlay) techniques and repair welding procedures in accordance with Code and Buyer's requirements.All Weld Procedure Specification (WPS) documents are required to be issued in a single submiss,,equipment,technical information deliverables,"API 6D, Annex N(u)",,,CFIHOS-70000362,welding procedure qualification,no,yes,yes,,,,,,WAO,AFD,no,
CFIHOS-68000148,CFIHOS-30000807,ball valve,CFIHOS-90000055,IOGP S-562:2019,API 6D #04,Weld procedure qualification records,weld procedure qualification records,Define all shop and field welding (including cladding / weld overlay) techniques and repair welding procedures in accordance with Code and Buyer's requirements.All Weld Procedure Specification (WPS) documents are required to be issued in a single submiss,,equipment,technical information deliverables,"API 6D, Annex N(u)",,,CFIHOS-70000362,welding procedure qualification,no,yes,yes,,,,,,WAO,AFD,no,
CFIHOS-68000149,CFIHOS-30000806,ball control valve,CFIHOS-90000055,IOGP S-562:2019,API 6D #05,Welder performance qualification records,welder performance qualification records,"To define parameters, techniques and test results of all suppliers proposed welding procedures in compliance with Buyer's requirements. Suppler to use standard ASME, BS EN or AWS forms. Weld performance qualification records are to be cross-referenced to",,equipment,technical information deliverables,"API 6D, Annex N(y)",,,CFIHOS-70000413,welder qualification certificate,no,yes,yes,,,,,,WAO,AFD,no,
CFIHOS-68000149,CFIHOS-30000807,ball valve,CFIHOS-90000055,IOGP S-562:2019,API 6D #05,Welder performance qualification records,welder performance qualification records,"To define parameters, techniques and test results of all suppliers proposed welding procedures in compliance with Buyer's requirements. Suppler to use standard ASME, BS EN or AWS forms. Weld performance qualification records are to be cross-referenced to",,equipment,technical information deliverables,"API 6D, Annex N(y)",,,CFIHOS-70000413,welder qualification certificate,no,yes,yes,,,,,,WAO,AFD,no,
CFIHOS-68000150,CFIHOS-30000806,ball control valve,CFIHOS-90000055,IOGP S-562:2019,API 6D #06,Painting/coating certificates,enp / tungsten carbide hardfacing certification,"Certificate to state the Buyer's PO number; item number, tag number, and is required to verify that painting and / or insulation is in accordance with the Buyer's specifications or the Buyer approved specifications, as applicable, showing intermediate coa",,equipment,technical information deliverables,"API 6D, Annex N(d)",,,CFIHOS-70000239,general certificate,no,yes,yes,,,,,,WPTD,AFD,no,
CFIHOS-68000150,CFIHOS-30000807,ball valve,CFIHOS-90000055,IOGP S-562:2019,API 6D #06,Painting/coating certificates,enp / tungsten carbide hardfacing certification,"Certificate to state the Buyer's PO number; item number, tag number, and is required to verify that painting and / or insulation is in accordance with the Buyer's specifications or the Buyer approved specifications, as applicable, showing intermediate coa",,equipment,technical information deliverables,"API 6D, Annex N(d)",,,CFIHOS-70000239,general certificate,no,yes,yes,,,,,,WPTD,AFD,no,
CFIHOS-68000151,CFIHOS-30000806,ball control valve,CFIHOS-90000055,IOGP S-562:2019,API 6D #07,Non-destructive examination personnel qualification records,non-destructive examination personnel qualification records,"Copies of Qualification Certificates for the technicians / operators signing certificates are required. NDE Operators are required to be qualified by an authorised qualification body such as PCN, CSWIP according to EN ISO 9712/ISO 9712.",,equipment,technical information deliverables,"API 6D, Annex N(r)",,,CFIHOS-70000437,personnel qualification certificate,no,yes,yes,,,,,,WAO,AFD,no,
CFIHOS-68000151,CFIHOS-30000807,ball valve,CFIHOS-90000055,IOGP S-562:2019,API 6D #07,Non-destructive examination personnel qualification records,non-destructive examination personnel qualification records,"Copies of Qualification Certificates for the technicians / operators signing certificates are required. NDE Operators are required to be qualified by an authorised qualification body such as PCN, CSWIP according to EN ISO 9712/ISO 9712.",,equipment,technical information deliverables,"API 6D, Annex N(r)",,,CFIHOS-70000437,personnel qualification certificate,no,yes,yes,,,,,,WAO,AFD,no,
CFIHOS-68000152,CFIHOS-30000806,ball control valve,CFIHOS-90000055,IOGP S-562:2019,MD#01,Supplier master information schedule,information deliverables list,Schedule of specific information deliverables developed by the manufacturer and accepted by the purchaser to meet the information requirements defined in the agreed Information Requirements Specification (IRS).The schedule typically defines; a) informat,,equipment,contract management information deliverables,Contract Requirement,CFIHOS-20000016,information management,CFIHOS-70000099,master document register,no,no,yes,,WAO,,WAO,,,AFC,no,
CFIHOS-68000152,CFIHOS-30000807,ball valve,CFIHOS-90000055,IOGP S-562:2019,MD#01,Supplier master information schedule,information deliverables list,Schedule of specific information deliverables developed by the manufacturer and accepted by the purchaser to meet the information requirements defined in the agreed Information Requirements Specification (IRS).The schedule typically defines; a) informat,,equipment,contract management information deliverables,Contract Requirement,CFIHOS-20000016,information management,CFIHOS-70000099,master document register,no,no,yes,,WAO,,WAO,,,AFC,no,
CFIHOS-68000153,CFIHOS-30000806,ball control valve,CFIHOS-90000055,IOGP S-562:2019,MD#02,Delivery schedule,delivery/production schedule,"Schedule depicting, as applicable to the service or product scope, design, supply, manufacture, inspection, testing and delivery activities to be executed by manufacturer/sub-suppliers.Schedule details typically**  include;.a) Contractual milestonesb)",,equipment,contract management information deliverables,Contract Requirement,,,CFIHOS-70000298,procurement schedule,yes,yes,yes,,,,,,WAO,AFD,no,
CFIHOS-68000153,CFIHOS-30000807,ball valve,CFIHOS-90000055,IOGP S-562:2019,MD#02,Delivery schedule,delivery/production schedule,"Schedule depicting, as applicable to the service or product scope, design, supply, manufacture, inspection, testing and delivery activities to be executed by manufacturer/sub-suppliers.Schedule details typically**  include;.a) Contractual milestonesb)",,equipment,contract management information deliverables,Contract Requirement,,,CFIHOS-70000298,procurement schedule,yes,yes,yes,,,,,,WAO,AFD,no,
CFIHOS-68000154,CFIHOS-30000806,ball control valve,CFIHOS-90000055,IOGP S-562:2019,MD#03,Progress report,progress report,"Report detailing activities completed in the period, percent complete against planned, activities planned for the next period, risks/areas of concern, cause of any delays and proposed recovery plans, concessions, internal and outsourced inspection and aud",,equipment,contract management information deliverables,Contract Requirement,,,CFIHOS-70000300,progress report,no,yes,yes,,,,,,WAO,AFD,no,
